Province Name,Denomination,Address,Tel,Fax
Marrakech,SENTIER BERBERE,"Av. Mousdalifa, Arset Sinko II, Appt n°1",0524 308769,0524 308780
Marrakech,SILVER TOURS,"55, Bd Zerktouni, Résidence Taieb",0524 436203,0524 436310
Marrakech,SMART EVENTS,"Circuit de la Palmeraie, à Côté de la Superette",0524 308561,0524 368740
Marrakech,SOCIETE ASNI DIAMANE VOYAGES,"3, Rue Sidi Bouchouka Arset Lamaach",0524 377799,0524 377799
Marrakech,SOUMA TRAVEL,"N°16, Rés Las Torres, Av Yacoub El Mansour",0524 432143,0524 432066
Marrakech,SOUMIA VOYAGES,"Complex Kawkab, rue Imm Chafai n°47 - Guéliz",0524 432036,0524 448915
Marrakech,SPECIAL INTEREST TRAVEL,"Angle Bd Yacoub El Mansour,Rue du Centre Américain Im Agouatim 4étage n°20Guélz",0524 420285,0524 420119
Marrakech,SPORT TRAVEL,"154, Bd Med V, Guéliz",0524 439968,0524 439969
Marrakech,STAR WAY,"Av Allal El Fassi, Complexe des Habous, Porte 6 n° 14",0524 311234,0524 311236
Marrakech,STEP TRAVEL,"9, Rés Amira 3, Av Yacoub El Mansour, Guéliz",0524 422967,0524 431647
Marrakech,SUNSETOURS,"84, Bd Med Zerktouni Guéliz",0524 438590,0524 438589
Marrakech,TAIFI TRAVEL,"RDC 9 Opération Loudaya, Massira 1 Hay Hassani",0524 349752,0524 349752
Marrakech,TERRA MONDE VOYAGE,"Renne 47, Angle Khalid Bnou El Oualid et Av. des Nations Unies, n°56",0524 439477,0524 439477
Marrakech,TERRA NOMADIC TRAVELS,"Lot El Massar n°1359, 1er Etage",0808 521887,0808 521887
Marrakech,TERRA SUD SERVICES,"Imm n°1, Appt n°10, 4è étage, Av. Yacoub El Mansour, Guéliz",0524 435094,0524 458671
Marrakech,TERRES & VOYAGES,"N° 137, Lot Zerktouni Extension Bouakkaz",0524 437153,0524 437192
Marrakech,TINMEL VOYAGES,"RDC Rés Wassim, n°8-8A, Angle Rue Ibn Atya et Sebou, Guéliz",0524 446712,0524 446712
Marrakech,TOP HOTEL MAROC     (EX: SMART HOLIDAYS),"Rés warda Etage 3, N°16 Yacoub El Mansour",0524 434326,0524 434326
Marrakech,TOSCA VOYAGES,2 rue Ibn Aicha Guéliz,0524 431795,0524 446489
Marrakech,TOUBKAL ADVENTURE,"N°22, Rue Oum Errabie, Imm Nakhil, Guéliz",0524 457956,0524 457956
Marrakech,TOUBKAL VOYAGES,"Appt A2, 1er ETG Imm D Borj Ourika Lot Mhamid 9 n°8 Arrondissement Menara",0524 373228,0524 373228
Marrakech,TOUDGHA VOYAGES,"Appt n°14, 3ème étage, Imm.Bloc C, Résidence Bab Doukala, Avenue Asfi",0524 433985,0524 433986
Marrakech,TOURISME CONGRES INCENTIVE MOTIVATION,Résidence Khattabia II Av Abdelkrim Khattabi,0524 437007,0524 436768
Marrakech,TOURISMONDE,Passage Ghandouri n° 61 rue Yougoslavie Local 56 Guéliz,0524 420908,0524 420908
Marrakech,TRACES BERBERES CULTURE ET AVENTURE,"Av. My Abdellah, Imm Ahlam II, 1er étage, Appt n°5",0524 431308,0524 420574
Marrakech,TRAVEL ACCESS,"Bureau n°7, Etage 2, Imm Koutoubia, Center 2, Bd Hassan II",0524 437667,neant
Marrakech,TRAVEL CONSULTING GROUP,"Prestige Targa, Imm 3, Bureau 2, Targa",0524 395388,neant
Marrakech,TRAVEL DESIGN,"Quartier Aïn El Mouroudi, Rés Davinci B11 Rue Mouquaouama, Guéliz",0524 448275,neant
Marrakech,TRAVEL LINK,"401, Imm D Marrakech Plaza Guéliz",0524 424880,0524 438765
Marrakech,TRAVELSCENE,"101/99 Rue Yougoslavie Imm Bagatelle, Appt n°6, Guéliz",0524 431369,0524 431369
Marrakech,TREE CAMELI TOURS,Angle Rue Med Lakhssim n°31 Angle18 Av Cheikh Rabhi Hay Youssef Ben Tachfine 3è étage,0524 420131,0524 431012
Marrakech,UNITOURS MAROC,"Appt n°1, Imm D, Résidence Ahlam II, Av. Prince My Abdellah",0524 446913,0524 446914
Marrakech,VACANCIA,"Résidence Koutoubia, Centre 2, AV. Hassan II, 4è étage n°22",0524 430153,0524 430153
Marrakech,VECTOURS,"Av. yacoub El Mansour, Résidence Drarga, 3ème étage, Suites 51 et 52",0524 446477,0524 446461
Marrakech,VIAJES MARRAKECH TOURS,"Rue Yougoslavie, Imm N°96 Bureau N°10",0524 430846,neant
Marrakech,VIEW MOROCCO,"Magasin n°58, Marché Mhamid 3",0524 010759,neant
Marrakech,VOYAGES 21,"Bd Prince Mly Abdellah Imm Taiba A, 1er étage, Appt n°1",0524 331007,0524 304952
Marrakech,VOYAGES MAAK,"Appt n°308, 3è étage Imm 245, Propriété Raissa II Av Med V",0525 090180,neant
Marrakech,WIN TRAVEL MOROCCO,"53, Av. Tarek Ben Ziad, Appt n°3, Guéliz",0524 448509,0524 448385
Marrakech,WORLD 2 MEET MOROCCO,"8, Av Abdellkrim El Khettabi 3è étage, n°6 Rés Jnane Atlas, Guéliz",0524 432993,neant
Marrakech,WORLD TRIP,"N°A-3, Imm Ali-B, Av Cheikh Rabhi Hay Youssef Ben Tachfine, Guéliz",0524 420577,0524 420577
Marrakech,YABYO INTERNATIONAL TOURS,"RDC Bureau n°1, Imm 23, Guéliz Av Yacoub Al Mansour",0524 432640,neant
Marrakech,YIN YAN TRAVEL,"58, Av. Abdelkrim El Khattabi, Imm Manis A 1, Semlalia",0524 434668,0524 434668
Marrakech,ZBAÏR VOYAGES,"Hay Lahrach, Bloc 12, n°110",0524 341409,0524 498047
Marrakech,ZENITH VOYAGES,"29, rue Yougoslavie, Appt n° 38, Guéliz",0524 420205,0524 420202
Marrakech,ZONA C,"Rue Mly Rachid, Imm Mjadli 5ème étage, Guéliz",661629690,0524 421830
Marrakech,Z'TOURS,"312, Av. Prince Moulay Abdellah, Rés Al Hamra A n°41",0524 312002,0524 314827
Meknès,3N EL OUJDI ASFAR,"Angle Rue Tarfaya, Mly Ali Cherif, un magasin en RDC N°17",neant,neant
Meknès,AGENCE  VOYAGE ADRAR,"Av. Allal Ben Abdellah, n°4, Imm 25, VN",0535 523211,0535 523207
Meknès,AGENCE AL BICHR DE VOYAGE ET DE TOURISME,"Magasin au N°4, Bd Ahmed Dirhoussi Zitoune",0535 550003,0535 550003
Meknès,AGENCE RIAD OUISLANE DE TOURISME,"Riad Ouislane 1, N°923, Ouislane",0532 024875,532024874
Meknès,AGENCE TAWAF DE VOYAGES ET DE TOURISME,"19, Lot Yasmina, Bd Chawiya, Hay Sultan Sidi Mohamed Ben Abdellah, Zitoune",0535 453000,535439817
Meknès,ALPHA OASIS TOURS,"Magasin 15, n°62 Galerie Mimosa Av. Idriss II V.N",0535 403718,0535 403718
Meknès,ANOUAR TOURS & TRAVELS   (EX: AGENCE MEZIANE),"Imm 37, Etage 1, Appt 3, Lot Marjane 2, Med VI, Route Agourai Ismailia",0535 537576,neant
Meknès,ARTISAN VOYAGE,"MAG 18, Imm L, RDC, Lot Al Fath Al Moubine, Bd Zitoune",0535 460000,0535 024266
Meknès,ATINA TRAVELS,"Marjane 2, N°1699, Bis 1, Av. Med VI, Route Agouray",0535 468070,0535 468877
Meknès,DECOUVERTES VOYAGES,"Imm Touiba, n°13, Angle Av Idriss II et Rue Kifa, VN",0535 510057,0535 510058
Meknès,DRISSI VOYAGES,10 rue Antsirabé ville nouvelle,0535 512831,0535 513372
Meknès,EL MENZEH VOYAGES,"10 Passage El Housseini, rue Safi",0535 402761,0535 517509
Meknès,EL YOUSRE,"Imb 17, route de Sefita Diour Essalam",0535 550297,0535 550364
Meknès,FILATOUR,"Réseidence Mimosa, BN20, Idriss II, VN",0535 403337,0535 403291
Meknès,MAGHREB AL ANDALOUSS,"20, Rue Kénitra, Passage Al Houssaini, VN",0535 513657,0535 511180
Meknès,MEKNES VOYAGES,"7, Rue Taroudant VN",0535 515176,0535 515156
Meknès,MILLE TOURS,"N°3, Imm 48, BD Allal Ben Abdellah, VN",0535 510007,0535 510008
Meknès,NEW BOUSSOLE TRAVEL (EX: LA BOUSSOLE),14 Rue de Paris VN,0661 233251,0535 523268
Meknès,OUALILI VOYAGES,21 Av Idriss II- VN,0535 524214,0535 511559
Meknès,PROMO VOYAGES,"N°2, rue de Kenitra",0535 528991,0535 528990
Meknès,RAMLA TOURS,"Mag n°4, Imm 6, Complexe My Ismail-VN",0535 514351,0535 514351
Meknès,SALSABILA VOYAGES,"N°81, Bd Abdelkrim El Khattabi, Sbata",0535 453000,0535 513333
Meknès,SOCIETE BASMA VOYAGES,"5, Bd Allal El Fassi, VN",0535 515455,0535 515454
Meknès,STE SAFWA VOYAGE,"196, Rue Al Qods, Quartier Riad",0535 536263,0535 536263
Meknès,STE TOTO VOYAGES,"137, Lotissement El Fath Toulal",0535 535303,0535 553386
Meknès,TAFILALET TOURS,"N°23, Bis Av. Hassan II, VN",0535 525527,0535 525527
Meknès,"TAZI TRAVELS ""S2TA""","13, Résidence Al Madina 3 Av des FAR VN",0535 513737,0535 513333
Meknès,TERIS VOYAGES,10 Av Hassan II,neant,neant
Meknès,VOYAGES ALLA,"5, rue de Beyrouth BP 72",0535 520305,0535 513309
Meknès,ZITOUNA VOYAGE,"76 Bis, Av. des FAR, Magasin n°5",0535 527296,0535 517398
Midelt,STOCKDALE MOROCCO TRAVEL,Angle Av My Driss et Route de Meknès,0535 583392,0535 583392
Mohammedia,AMBASSADOR TRAVEL,"Angle Bd des FAR et Bd Allal Ben Abdellah, Rés Annakhil, n°19",0523 324303,0523 312085
Mohammedia,ANDALOUSSI,Imm du Parc rue Fès,neant,neant
Mohammedia,ESCAPIA,"16, Résidence Semlal, Av. Med VI, Lot. Massira Khadra, ETG 2, Appt.8",0523 327475,0523 327475
Mohammedia,FEDALA VOYAGES,Av. des F.A.R,0523 327390,0523 327393
Mohammedia,HAFSA VOYAGES,"Angle Rues Allal Ben Abdellah et Rachidi Résidence Fdala Center, Imm. A n°3",0523 315551,0523 315553
Mohammedia,L'ILE DES VOYAGES,"7, Rue Borgogne, ETG 2, Appt.6, Résidence Jawad",0523 310310,neant
Mohammedia,MAGHREB ARABE TRAVELS,"Lot Viadici, Rés Rania, Imm E Appt 6, 2è étage, Ain Harrouda",0522 744093,neant
Mohammedia,ZENATA WORLD TRAVEL (EX: ZENATAS TRAVELING),"Bd. Palestine, Db. Riad 2, N°321",0523 310016,0523 310017
Nador,AGENCE DE VOYAGE COLOGNE,"Av. Hassan II,  n°221, Driouch",0536 367393,0536 366307
Nador,AL KHOUZAMA,"Résidence Ryad, 9 Bd Général Ameziane",0556 600184 / 056 607946,0556 337832
Nador,ALSACE TOUR,"145, Angle Bd Mly Chrif et Rue El Massira",0536 607171,0536 607677
Nador,BAB AZHAR TOURS,"50, Bd Med V",0666 602047,0556 330400
Nador,BOUYLAGHMANE TOURS,"Avenue Hassan II, n°350 Aruit P",0536 362658,0536 362331
Nador,CHARKAOUI VOYAGES (SARL) AU,"406, Av. Al Massira",0536 333838,0536 333839
Nador,EL JAOUDA VOYAGES,"80, Bd Sakia El Hamra",0536 337430,0536 601159
Nador,FAVORI VOYAGES,93 Bd Tanger,0536 330213,0536 330216
Nador,FERAAOUNE TRANS,"Lot Lahsini Omar, N°61-Zaio",0536 608402,0536 608402
Nador,IBTISSAM VOYAGES,"QT Al Matar, Imm Anassim 1 ""IMOJAB 1""",0536 382221,0536 382223
Nador,ISLAM VOYAGES,"39, Bd Hassan II, Driouch",0536 367265,0536 367266
Nador,KABDANI VOYAGES,Av. El Massira n°338,536601434,536601436
Nador,LA MEDITERRANEE,"14, Avenue Mohammed V",0536 602634,0536 603517
Nador,MAHI VOYAGES,"Hay Farah, Zaio, BP:330",0536 608171,0536 608171
Nador,MALAYSIA VOYAGES,"Bd Youssef Ibn Tachfine 178, Appt. n°1",0536 333315,0536 333314
Nador,MANATOURS VOYAGES,"5, Bd Prince Héritier Sdi Mohamed (sidi safal)",0536 606860,0536 606677
Nador,MEDVISION VOYAGES,"Av. Al Massira, n°3, Zaio/P",0536 608405,0536 608405
Nador,MESSAUDI TOUR,"Bd Hssan II, n°75, Arouit",0536 363669,0536 363669
Nador,MIDAR VOYAGES,"Rue El Massira El Khadra, Midar",0536 364495,0536 364497
Nador,NASIMRIF VOYAGES,"Rue Boukharest, N°2, Bd Ezzallaka, Hay Souk Zaio",0536 339533,0536 339533
Nador,OUARIA TOURS,"Quartier Laary Cheikh, Rue 9, n°77",0536 607690,neant
Nador,RESEAUX VOYAGES,"Av. 3 mars, n°121",0536 320533,0536 320544
Nador,SOLAIRE VOYAGES,"Hay Issabanen, Route de Zeghanghan",0536 604163,neant
Nador,SONA TOURS,"19, Bd Mohamed V Zaio",0536 339516,536339576
Nador,SOUNDOUSS VOYAGES,"Bd 3 mars, n° 3",neant,neant
Nador,STE VOYAGES SECIL,"Hay Ouled Brahim, En face Lycée Nador",0536 602669,0536 349377
Nador,SURPRISE VOYAGES,"272, Bd El Massira",0536 320748,0536 691417
Nador,TAFARSIT VOYAGES,"Rue 20 Août, Midar/P Driouch",0536 364031,0536 364057
Nador,VOYAGES LIXUS,204 Av des FAR BP 126,neant,neant
Nador,VOYAGES MEKKA,"76, Avenue Al Moukaouama, BP 120",0536 601411,0536 601413
Nador,WIDE WORLD TRAVEL,"Centre Dar El Kebdani, Al Massira-Driouch",0536 410936,neant
Nador,YAZIDI VOYAGES,Hay Oulad Aissa Béni Enzar P,0536 349951,0536 349930
Ouarzazate,DESERT ET MONTAGNE MAROC,"24, Kasbah de Taourirt BP 93 - 45000",0524 885146,0524 886352
Ouarzazate,ECLIPSE VOYAGES,Lotissement Dades n°7 /CGI Avenue Mansour Dahbi,0524 885626,0524 885630
Ouarzazate,KSOUR VOYAGES,"11, Place 3 Mars, Bd Mohamed V",0524 882840,0524 884899
Ouarzazate,LE CHÂTEAU VERT,"Bd, El Hizam Hay El Moukaouama n°6",neant,neant
Ouarzazate,LEADER TRAVEL SERVICES,"8, Av. Mansour Eddahbi",0524 886654,0524 886655
Ouarzazate,MAROC-EXPERIENCE-SARL,"N°04 Hôtel Bab Essahra, Place El Mouahidine",0524 883363,524883363
Ouarzazate,NAGA TRAVEL,"Av. Med V, Kissariat El Ghifari 4500",0524 885908,0524 885906
Ouarzazate,NOMAD' ATTITUDE,"N°2, Lotissement n°II, Maison n°47, Centre Skoura",0524 852287,0524 852282
Ouarzazate,RJ TRAVEL AGENCY,"144, Hay El Mansour Eddahbi",808508179,808508179
Ouarzazate,STE INFINITE MOROCCO,"N°3, Place du 3 mars",0524 885556,0524 885557
Ouazzane,MELKAOUI TOURS,"Quartier Laadir, Place 3 mars, Résidence Nour n°30",808542503,neant
Oued Zem,SOCIETE MAROCAINE DU TRANSPORT INTERNATIONAL ET TOURISME,"8, Rue Bendaoued",0523 411719,0523 411719
Oujda,AGENCE DE VOYAGE CHETOUANI,"18, Angle Hassan Loukili et Rue Cordoba",0536 685521,0536 691334
Oujda,AL HIDAYA VOYAGES,"Bd Allal El Fassi, Imm n°5, Appt n°3",0536 710824,0536 710825
Oujda,AL WAHDA VOYAGES,"Bd Idriss Al Akbar, Imm El Fellaqui",0556 702722,536710802
Oujda,ASFAR MAKA WA AL MADINA,"Hay Si Lakhdar, Rue B37 n°1 Bis",0536 516351,neant
Oujda,AVENIR TOURS VOYAGES,"71, Bd Derfoufi Mohamed",0536 689498,0536 711568
Oujda,BEAU SEJOUR VOYAGE,"Rue Farhat Hachad, Imm Essada, Bloc D, RDC",0536 707024,0536 707026
Oujda,EL FATH VOYAGES,"Bd El Fetouaki, N°28",0536 705151,neant
Oujda,ESSALAMA VOYAGES ET TOURISME,"15, rue Ramadan El Gadi",0536 691909,0536 681301
Oujda,EUROPA VOYAGES,"17, Angle Bd Zrektouni et Mohamed Lagrari",0536 682627,0536 682793
Oujda,GLOBTOUR,"102, Bd Allal Ben Abdellah, Imm Laälaj",0536 697012,0536 697042
Oujda,IBTISSAMAT ACHARK,"14 Bis Rue de Fès, El arioun Sidi Mellouk",0536 670444,0536 670400
Oujda,ISLY VOYAGES,"51, Bd Derfoufi",0536 681470,0536 691222
Oujda,ISRAE VOYAGES,"6, Bd Zrektouni",0536 707122,0536 707122
Oujda,JEDDA VOYAGES,"107, Av. le Prince héritier Mly El Hassan",0536 680606,0536 680600
Oujda,MAROC VOYAGES TOURISME,"110, Av Allal Ben Abdellah",0536 683993,0536 706527
Oujda,MOLTAKA VOYAGES,"Rue Jaâfar Ibnou Attia, Imm Ouachani 2, n°20 Bis",0536 686803,0536 686804
Oujda,MOULOUYA VOYAGES TRANS,Angle Bd Med Derfoufi et Omar Riffi,0536 707826,0536 707826
Oujda,MTT HOLIDAYS (Ex:TRANS VOYAGES),"N°93, Bis Bd Med V",0536 708182,0536 689223
Oujda,OUJDA VOYAGES,Angle Bd Mohamed V et Allal Ben Abdellah,536681154,0536 704628
Oujda,OUMASSINE VOYAGES,"Angle Bd Derfoufi et Route Ahfir, Imm El Aioun Sidi Mellouk, Magasin n°8",0536 703536,0536 703539
Oujda,SALAM AZUR,Angle Bd Derfoufi et Rue Mourabitine,0536 690035,0536 690037
Oujda,SOCIETE ORIENT MAGIC VOYAGES,"50, Bd Med Ben Abdellah",0536 689112,0536 702819
Oujda,SORI TOURS,"102, Bd Allal Ben Abdellah",0536 702302,0536 702298
Oujda,SOUVENIRS VOYAGES,"95, Résidence Alami, Bd Lieutenant Belhoucine",0536 708555,0536 708621
Oujda,STE AL OUMA VOYAGES,Rue Tairet n°256,0536 682011,neant
Oujda,WILAYA TOURS,Résidene Safae Bd Mohamed V,0536 688825,0536 706702
Rabat,ABEL TOUR,"Imm 9, 4è étage, Rue El Khatawat, Agdal",0537 408076,0537 630969
Rabat,ABM TRAVEL,"Av Hassan II, n°229, 1er étage, Appt n°3",0537 205952,0537 205952
Rabat,ABRAM TRAVEL,"Rue El Khatawat, Imm N°9, 1er étage, Agdal",0537 681452,0537 681452
Rabat,AGENCE DE VOYAGE ABOU JAMAL,400 Nahda 1 Complt,0537 638830,0537 638830
Rabat,AHLA TOURS,"N°1, Av. Med V, Imm Saada, Appt n°107",0537 724202,0537 704779
Rabat,AJNIHA,"32, Rue Jbal Tazaka, Appt n°8 Agdal",0537 779100,0537 682242
Rabat,AJNIHAT AL AMANE,"17, Av. de la Tour Hassan, Hassan",0537 701928,0537 701897
Rabat,AL ASSIMA TRAVEL,"Hay El Manzeh, Complexe El Manal, Imm G, Appt n°1, CYM",0537 797953,0537 797953
Rabat,AL HARAMAINE VOYAGES,"14, Av d'Alger",0537 763352,0537 763372
Rabat,AL HASSANIA VOYAGES,"Imm 58 Angle Av Michlifen et Rue Jbel Ayachi, Agdal",0537 639257,037 639685
Rabat,AL KAWTAR TRAVEL & EVENTS,"Rue Tayeb Bessir, Appt 2, Imm 12, Agdal",0537 681974,0537 681974
Rabat,AL SHEHRI VOYAGES,Angle Av Fall Ouled Oumeir et Rue Agoulmane Sidi Ali Imm Bonheur Appt 1 Agdal,0537 680070,808531142
Rabat,AL WIFAK TRAVEL AGENCY,"Projet Al Kora Gh93-C471, Yaacoub Al Mansour",537404478,neant
Rabat,ALHAMBRA TOURS,"22 Rue Jbel Al Ayachi n°9, 4è étage, Agdal",0537 675467,neant
Rabat,ALL IN ONE TOURS,"33, Rue Loubnane, Appt N°2, Océan",0537 200555,0537 200554
Rabat,ALMANAL TRAVEL  (EX:KHOUYA VOYAGES),"Av Al Maghreb Arabi, Résidence Perle de la Médina, Imm B n°B24",0537 632863,neant
Rabat,ALTAIR TOURS INTERNATIONAL,467 Av Med V,0537 729940,0537 729950
Rabat,ALTITUDE VOYAGES,"N° 6, Résidence Rif, Angle Fal Ould Oumeir et Av de France",0537 778400,0537 778414
Rabat,ARIANE TOURS,"2, rue Copernicia, Secteur 19, Bloc A2, Hay Riad",0537 564056,0537 564156
Rabat,ASFAR TOUR HASSAN,"50, Av Allal Ben Abdellah",0537 700804,0537 700966
Rabat,AVIA TOURS INTERNATIONAL,"5, Av Trabless",0537 731131,0537 731158
Rabat,BEAUTIFUL MOROCCO VOYAGES,"Angle Av. Abdelmoumen et Rue Mahdia n°9, Hassan",0651 759276,0537 570488
Rabat,BI. TRAVEL,Imm C2 n°1 Hay El Menzeh,0537 790642,0537 790642
Rabat,BLUE RIVER VOYAGES,"16, Rue Anaba, Appt n°4, Hassan",0537 720108,0537 705882
Rabat,BOUREGREG EVENTS & TRAVEL,"113, Av Allal Ben Abdellah",0537 731093,0537 731095
Rabat,CAP TOURS,"7 Rue Damas, 2ème étage",0537 733571,0537 731878
Rabat,CELEBRITY VOYAGES,"RDC Imm 11, n°2 Rue Médina, Hassan",0537 703622,0537 324658
Rabat,CHELLAH VOYAGES,10 Av Mly Youssef,0537 200820,0537 200821
Rabat,COLCHIQUE VOYAGES,Imm N°12 Angle Av Al Abtal et Rue Oued Ziz 4è Etage Appt N°12 Agdal,0537 777781,0537 682987
Rabat,DA VINCI HOLIDAYS,"Rue Melouiya, Imm 54, Appt. N°6, Agdal",0537 680665,0537 680667
Rabat,DIJA TOURS,"47, Rue Patrice Lumumba",0537 660221,0537 762680
Rabat,DIWAN TOURS,"30, rue Abou Faris Al Marini, Appt n°1, Place Piétri",0537 725452,0537 725451
Rabat,EL MOUNA KARIM ( Ex:FIGUIG OASIS TOURS),"38, Av Chellah, Rés Riad Hassan B, Appt n°4, Hassan",0537 261136,0537 261136
Rabat,EL QAMRA VOYAGES,"Résidence Firdaous, n°2 Av. Al Kifah",0537 795210,neant
Rabat,ELITE TRAVEL MOROCCO,"2, Angle Rue Abidjan et Av. de la Résistance, Océan",0537 727778,537729909
Rabat,ELYSEE TRAVELS,"79, Av. Fal Ould Oumeir, Appt n°6, Agdal",0537 771116,0537 771074
Rabat,EMI TOURS,"N°9, Imm 17, Angle Av. Fal Ouled Oumeir et Rue Baht, Agdal",537777724,0537 202727
Rabat,EQUINOXE VOYAGES,"Av. Ennakhil, Résidence Hasnae, Magasin n°5 Hay Ryad",0537 717252,0537 713197
Rabat,ERAMTOUR,"Bureau 5 et 6, Imm n°30, Rue Rhamna, Cité administrative Aviation, Souissi",0537 634488,0537 630969
Rabat,ESF,"14, Rue Mohammédia, Appt n°1, Hassan",0537 262606,0537 720460
Rabat,EVENEMENT VOYAGE,"N°3, Rue l'Inde et Av Kbibate",0537 737371,0537 799931
Rabat,EXECUTIVE TOURS,"Imm Kamar, Apt 2 Bis 29, Rue Jabal Toubkal, Agdal",0537 777764,0537 777769
Rabat,FADEL VOYAGES,"5, Rue Baït Lahm, Angle Rue Av. Med V",0537 200602,0537 200684
Rabat,FAJR TOUR,"Rue Brahim Roudani, Imm n°41, Appt n°3, Océan",0537 721770,0537 721767
Rabat,FAMILY VOYAGES,"24, Av. Omar Ibn El Khattab, Résidence Edelweise, Agdal",0537 774331,0537 778229
Rabat,FAN TOURS,2 Place Bab Rouah,0537 203272,0537 203275
Rabat,FAST VOYAGES,"2, Rue du Caire",0537 708091,0537 706734
Rabat,GOLF PLUS EVENEMENTIEL,"4, Angle Bd Oqba et Rue El Bayrouni n°3",0537 680135,0537 681251
Rabat,IKTICHAF TRAVEL,"Rue Dayet Aoua, Imm 6, Bur n°9, 2è étage, Agdal",0537 752793,neant
Rabat,ILY VOYAGES,"429, Av. Hassan II, MAG n°16",0537 769859,0537 701659
Rabat,ILYA TOURS,"Bd Med VI, Lamar Center, n°B3, Souissi",0537 634555,0537 660981
Rabat,INCENTIVES & TRAVEL EVENTS,"4, Rue Badr, Appt n°09, Agdal",0537 670064,0537 670064
Rabat,INSOLITES VOYAGES,"11, rue Dayat Efrah, Résidence Enour, Appt n°12, Agdal",0537 775777,0537 777577
Rabat,INTERNATIONAL TRAVEL CONSULTANTS,"36, rue Idriss El Akbar, RDC 4, Hassan",0537 737474,0537 735254
Rabat,JUST TRAVEL  (EX: SUPRALIGNES VOYAGE),"RDC 22 Rue Ibn Tayeb Kadiri, Les Orangers",771272727,0537 282877
Rabat,KASBAH VOYAGES,"Av. My Rachid, Imm 17, Appt.4",0537 703080,0537 700546
Rabat,L&B ORGANISATION,"17, Rue Harroun Rachid, Appt n°5, Agdal",0537 673763,0537 673763
Rabat,LABEL TOURS,"N°575, 1er étage, Groupe Al Ahd, Nahda 1",0537 636261,0537 650753
Rabat,LES OUDAYAS TRAVEL,"7, Rue Houssein 1er, Hassan",0537 730673,0537 730673
Rabat,MAISON DE VOYAGE ET TOURISME,"N°20, Rue Brahim Roudani, Kebibat",0537 728712,0537 728712
Rabat,MAJESTIC TOURS,"46 Fal Ould Oumeir, Appt 5, Agdal",0537 675724,0537 704693
Rabat,MARI SAR MANAR TRAVEL,"Rez Chaussée 2/3, Hay Al Manar",0537 708107,0537 701178
Rabat,MARJANA VOYAGES,"Galerie Kays, Magasin n°71, Agdal",0537 683461,0537 683460
Rabat,MARRAKECH BLUE VOYAGES,"34, Rue Oued Ziz, Appt n°2, Agdal",0537 681687,0537 681687
Rabat,MODERN TRAVEL AGENCY,11 Sahat El Joulan Hassan,0537 704691,0537 704693
Rabat,MOOIZ VOYAGES,"125, rue Jebli, Av. Allal Ben Abdellah",0537 730873,0537 730873
Rabat,MOON TRAVEL AGENCY,"Av. Abdelkrim El Khattabi, Kissariat Al Mohit MAG 09",0537 660555,neant
Rabat,MOROCCAN EXPRESS TRAVEL & EVENTS,"59, Av. Fal Ouled Oumeir, Appt n°2 Agdal",661192939,0537 774441
Rabat,MRC TRIPS,"Imm Borj Salama, Rue Loubnane 35 Studio n°24, 4è étage, Ocean",0537 709755,neant
Rabat,NADOMAR TRAVEL,"14, Av. Al Atlas, n°27",0537 771777,0537 771777
Rabat,NALI VOYAGES,6 rue El Khalil n°17,0537 701418,0537 701420
Rabat,NIRVANA VOYAGES,"10, Rue Yamama, Escalier B, Appt n° A",0537 729130,0537 729132
Rabat,NON STOP VOYAGES,"429, Av. Hassan II, n°9, Diour Jamaa",0537 263505,0537 733577
Rabat,NOUR VOYAGES,"Hay Nahda, Résidence El Waha, Imm 04, n°03 au rez-de-chaussée",0537 686815,0537 680564
Rabat,PACK VOYAGES,1bis av Ibn Sina Agdal,0537 771684,0537 777068
Rabat,PREMICES VOYAGES,21 Place Abou Bakr Essaddiq Appt n° 5 Agdal,0537 773322,0537 776349
Rabat,PROVIDENCE TRAVEL & EVENTS,Angle Bd Akreuch et Rue Abou Ayoub El Ansari Youssoufia-Souissi,0537 630650,0537 630647
Rabat,PURE MOROCCO,"Av. Hassan II, Résidence Ahssan Dar II, Imm B3, Appt 8",0537 699090,0537 699092
Rabat,RAMSES TOURS,"16, Rue Omar El Jadidi, MAG 1, Kebibat",0537 697292,0537 697294
Rabat,RAWANE TRAVEL,"49, Av. Madagascar, MAG n°2, Diour Jamaa",0537 200212,0537 731146
Rabat,RITAJ VOYAGES & EVENTS,"38, Angle Rue Abou Chouaib Doukkali et Av Pasteur, Les Orangers",0537 707989,0537 707961
Rabat,SAFARI VOYAGES,"Angle Rue Al Mariniyine et Al Alaouine 13, Tour Hassane",0537 262720,0537 262719
Rabat,SECURE TRAVEL AGENCY,"37, Centre Commercial Galaxie, Av Imam Malek et Rue du Rif, Souissi",0537 755769,037 759006
Rabat,SELVER VOYAGES,"MAG n°37, Bloc 4, n°11 Av. Almajd, Massira III, CYM",0537 795156,0537 795156
Rabat,SIGMA-BETA,"Angle patrice lumumba et Youssef Ben Tachfine, Magasin n°1",0537 727210,0537 727218
Rabat,SINBAD VOYAGES,"Av. Hassan II, 7, Rue Adarissa n°1, Tour Hassan",0537 208455,0537 208339
Rabat,SKYLINE TRAVEL,"13, Rue Benzarte, Place Piétri",0537 706288,0537 701654
Rabat,SMART AFRICA TRAVEL,"Rue Tansift, Imm 40, Bureau n°4, Agdal",0537 686178,neant
Rabat,SUPRATOURS TRAVEL,"Gare de Rabat Agdal, Av El Hadj Ahmed Cherkaoui",0537 686297,537777914
Rabat,TAM VOYAGES,"107, Av Allal Ben abdellah",0537 766145,0537 767240
Rabat,TASNIME VOYAGE,"33 Bloc JA, Hay Barid CYM",0537 690315,neant
Rabat,TAYS4TRAVEL,"N°221, Groupe Al Ahd, Hay Nahda 1",neant,neant
Rabat,TERRATOUR,"121, Av Allal Benabdellah",0537 262002,0537 261993
Rabat,TRAVEL 4 YOU  (EX: ELMAJDOULI TOURS),"27, Av. Prince Mly Abdellah, Imm R-E-M-A-R, Escalier A, Appt n°2",0537 729924,0537 729924
Rabat,TRAVELIUM,"5, Rue Jbel Bouiblane, Appt n°3, Agdal",0537 673635,0537 673632
Rabat,TRAVELS ALRAQIA,"Angle Av Sidi Med Ben Abdellah et Rue Ahmed Ben Aboud n°2 Qbibat, Hassan",0537 295204,neant
Rabat,TREKKING TOURS MAROC,"Av Abdelkrim Al Khattabi, Résidence Al Mohit Rue Oslo, Appt n° 3, Océan",0537 729185,0537 729177
Rabat,TRIOMPHE TRAVEL,"N°2, Rue Oqba, Agdal",0537 680378,0537 686023
Rabat,TUT TRAVEL AND TOURISM,16 rue Tanta,0537 707850,0537 702865
Rabat,UNIVERSEL TOURS,"68, Rue Melouya n°3, Agdal",700021292,700021293
Rabat,VECTO VOYAGES,12 Place Moulay Hassan,0537 708329,0537 708329
Rabat,VICTORY TRAVEL,"429, Av Hassan II, MAG 23 et 1",0537 708962,0537 708962
Rabat,VOYAGES SANS FRANTIERES,1 rue Tanta,0537 708215,0537 708216
Rabat,WONDERFUL TRAVEL AND EVENTS,"1, Rue Tayeb Labsir, Appt 7",0537 777141,0537 777142
Rabat,YASMINE TRAVEL MAAMOURI ET COMPAGNIE,"Rue Harroun Errachid Imm.6 Appt. 01/RDC, Agdal",0537 673045,0537 673034
Rabat,YOUSSEF VOYAGES   (EX:NAPOLEON VOYAGES),"N12-M1 RDC des Résidences les Camélias, Hay Riad",537571733,neant
Safi,ANNAWRASS VOYAGE ET TOURISME,"32, Rue Kariat Raiss 2, Quartier Labiar",0524 650442,neant
Safi,ATLANTIC HOLIDAYS,"Lot Bouzoubaa, Résidence Charaf, n°8, VN",neant,neant
Safi,LOKA VOYAGES,"7, Imm Ghaibi, Av Zerktouni ville - nouvelle",0524 627974,0524 626668
Salé,AGENCE DE VOYAGE KULTUREN,"8, Ensemble Immobilier Semlali Bloc 1, Immeuble 4, Bettana",537814116,0537 814103
Salé,AJNIHATE AL KHAIR LI-AL ASFAR,"Lot Fath El Khir n°51, Secteur 4, Hay El Farah, Karia",0537 827272,neant
Salé,AL-IMRAN VOYAGE,"Lotissement Assaada n°50, Mag n°3, Av. Mly Taib Alaoui",0537 886636,0537 886636
Salé,AMWAJ VOYAGE,"Résidence Essaada 3, magazin n°2, Hay laghrablia Route de Kénitra.",0537 882324,0537 882326
Salé,ANJOOM VOYAGE,"N°1, Imm n°7, Houfrat Lakouas, Route de Kénitra Salé",neant,neant
Salé,BAB ANASR,"Av. Ben Aboud n°85, Mellah Jedid",0537 883737,0537 882288
Salé,BAKKA VOYAGES,"N°2,  Av 6 novembre, Blad Bensaid, Tabriquet",0537 864202,0537 864193
Salé,DIAA TRAVEL,"Magasin n°98, Lot Maamoura, Sala El Jadida",0537 827782,0537 827783
Salé,GOOD FLY,"Saniat Smahiya, Rue 3, App n°4, Akouass Rue de Kénitra",0537 840200,0537 840100
Salé,HILTON VOYAGES,"Av Lalla Asmae, Imm n°7, Appt n°6, Tabriquet",0537 864246,0537 864286
Salé,LES VISITEURS VOYAGES,"Centre commercial, Angle Bd Med Bouabid, Bd Med Hassar, 1e ETG, n°11, Salé El Jadida",0537 711063,neant
Salé,MSM VOYAGES,"Hay Inbiaat, Av La Base Aérienne, Rue El Dafer n°1",neant,0537 813433
Salé,NOUR AL FIRDAWS VOYAGES,"Résidence Val Fleuri L Said Hajji, Imm n°6, Magasin 17",0537 788997,0537 788997
Salé,SANA VOYAGES,"Lot Cherif, N°46, Hsaine",0537 835471,neant
Salé,SWISSE TRAVEL,"A côté de la Mosquée Imam Malik, Hors Bab Chafaa n°1",0530 111239,neant
Salé,TWIN TRAVEL,"Av Abderrahim Bouabid, Imm 7, Magasin 3, Hay Salam",0537 800629,0537 800629
