Province Name,Denomination,Address,Tel,Fax
Casablanca,ILHAM VOYAGES,Angle Rue Ibnou Fariss et Rue Abou Ishak El Ouajjaj Résidence Etoile d'Or Maarif,0522 253035,0522 252940
Casablanca,ILÖT VOYAGES INTERNATIONAL,"Angle Bd. D'Anfa et 2, Rue Molière, Quartier Racine",0522 944933,0522 944932
Casablanca,ILS VOYAGES,"94, Rue Jean Jaures, Angle Bd d'Anfa",0522 260036,0522 260252
Casablanca,IMPERIAL DESTINATION,"408, Bd Zerktouni, Résidence Al Istikrar A, 2ème Etage, Appt n°4, Sidi Belyout",0522 207006,0522 205586
Casablanca,IMPERIAL VALLEY,"150, Rue Hadj Omar Riffi",0522 204590,0522 204778
Casablanca,IMTC,"122, Bd d'Anfa",0522 299209,0522 299202
Casablanca,INFINITY TRAVEL,"Angle Rue Mongolfier et Rue d'Aboukir Rés Sanar, Bourgogne",0522 297219,0522 297219
Casablanca,INNOVATOURS,"10, Rue Racine, Val Fleuri, Cité Plateau, Maarif",0522 237381,0522 984275
Casablanca,INTER VOYAGES,"4, Av des FAR",0522 203980,0522 223023
Casablanca,J TOURS,"30, Rue Mohamed Kamal, Centre Commercial, Sidi Beliout, 1A-RDC.",0522 303131,0522 442469
Casablanca,JACARANDA VOYAGES,"67, Rue Aziz Bellal, n°3è étage, N°2",0522 397911,0522 397913
Casablanca,JAMBO TOURS INTERNATIONAL,"58, Bd Abdellatif Ben Kaddour",0522 942828,0522 951023
Casablanca,JAZA VOYAGES,"53, Bd de Fès, Les Cretes, Californie, 1er Etage",neant,neant
Casablanca,JET SERVICES,"164, Bd d'Anfa",0522 399309,0522 365669
Casablanca,JINANE SKY,"11, Bd Dakhla, Cité Djemaa, Jamila 3, 20450",0522 594070,0522 598084
Casablanca,KM HOLIDAYS,"2, Bd Zerktouni",0522 220313,0522 220362
Casablanca,KTI VOYAGES,"3, Rue des Hirondelles (Rond Point Racine)",0522 398572,0522 398567
Casablanca,L'ATELIER DU VOYAGES,"57, Rue Jean Jaurès Gauthier",0522 369393,0522 369339
Casablanca,LE VOYAGE AUTREMENT,"5, Bd Abdellah Ben Yassine, Imm Belledone 6é Etage, n°2",0522 276076,0522 276074
Casablanca,LEICESTER TOURS,"112, Rue El Araar, Mers Sultan",0522 262600,0522 485253
Casablanca,LIBERTY INTERNATIONAL MOROCCO ex(NS Vg),"Romandie II, Bd Bir Anzarane, Tour Al Jazira, Appt n°3",0522 944038,0522 944030
Casablanca,LIGNE ASSALAM INTERNATIONALE,"14 Bis, Av. Hassan Seghir",0661 465520,neant
Casablanca,LINA TOURS,"N° 20, Rue Taha Houssine",0522 294306,0522 202619
Casablanca,LION VOYAGES,"110, Rue El Wahda, Rond Point Mers Sultan Bd Rahal Meskini",0522 266300,0522 265040
Casablanca,LM TRAVEL,"217, Bd Brahim Roudani, Maârif",0522 989292,0522 989147
Casablanca,LOTTO WAY TOURISM,"61, Av Lalla Yacout et ANG Mustapha El Maani Bur 67, 2è ETG",neant,neant
Casablanca,M S C INTERNATIONAL,"13, Rue Farhat Hachad",neant,0522 304094
Casablanca,M. TOURS,"16, Rue Jilali El Oraïbi",0522 273126,0522 208354
Casablanca,M.DESTINATION,"12-14, Rue du Marché Maârif",0522 235222,0522 235221
Casablanca,MACRO VOYAGES,"61, Bd Lalla Yacout, 1er ETG, N°57",0522 309323,0522 309324
Casablanca,MAI TOURISME,"218, Bd Mohamed V",0522 305050,0522 305031
Casablanca,MAJESTOUR,"Jamila 3, Bd Med 6, n°1677",808560510,0522 563948
Casablanca,MAMOUN SERVICES,"43, Bd Béni M'Guild",0522 800352,0522 809420
Casablanca,MANAR VOYAGES,"10, mars Bloc 34 n° 40, Sidi Othmane",0522 376377,0522 376379
Casablanca,MARESOL TOURS,"4, rue Abou Kacem Kotbari, Quartier Racine",0522 481239,0522 481223
Casablanca,MARHABA VOYAGES,"8, rue Faker Mohamed",0522 310375,0522 312738
Casablanca,MARIA HOLIDAYS,"Centre Riad 61, Av Lalla Yacout et Mustapha El Maani, ETG 2, BUR 71",neant,0522 302566
Casablanca,MAROC ALIZES TRAVEL,"158, Bd d'Anfa Résidence Auteuil, 6è étage",0522 363028,0522 397720
Casablanca,MAROC COMMUNICATION,"22, Rue Omar Slaoui",0522 295132,0522 295133
Casablanca,MEDINE VOYAGES,"33, Av. Hassan Séghir n°B8-7",0522 300484,0522 45 26 83
Casablanca,MENSOURI TOURISME TRAVEL SERVICES,"47, Rue Abou Soufiane",0522 296115,0522 263815
Casablanca,MERCURY TOURISM AND TRAVEL,"16, Rue Omar Slaoui",neant,neant
Casablanca,MHAIDAR TOURISME ET VOYAGE,"Lot Assabah, Rue 4, n°5, S M",neant,neant
Casablanca,MHT TRAVEL SARL (Ex:MAROC HORIZON TOURS),41 Rue Saad Ibnou Ouakass et Angle Rue Noussour,0522 484849,0522 484851
Casablanca,MID FAR TOURS,"Hôtel Hyatt Regency, Place Med V",0522 473888,0522 473890
Casablanca,MILLENIUM TRAVEL,"13, Rue Al Kassar, 1er étage, Maârif",0522 237365,0522 237357
Casablanca,MIRAI TOURS,"12, Rue El Quori, Sidi Belyout, 20000",0522 270770,0522 270370
Casablanca,MON VOYAGE (SARL),"16, Rue Washington, 1er ETG, Appt. N°1 gauche",0522 361213,0522 365573
Casablanca,MONARCH TRAVEL,"15, Rue Najib Mahfoud- Quartier Gautier",0522 470070,0522 470079
Casablanca,MONDE VOYAGE,"Rés Romandie II, Bd Bir Anzarane Tour Oualili, Appt n°5",neant,0522 940638
Casablanca,MONDO ZEN TRAVEL,"Rue El Bannafsaj, Numéro 15, 1er étage",0522 200290,
Casablanca,MOROCCO EVASION & EVENTS,"10, Rue Al Jihani, 3è Etage Droite Bd Al Massira, Quart Racine",0522 290165,0522 290165
Casablanca,MOROCCO GOLF SERVICES,"37, Rue Normandie, Rés Nada, 2è étage",0522 952560,0522 941130
Casablanca,MOROCCO INTERNATIONAL HOLIDAYS,"124, Bd Rahal El Meskini, ETG 1",0522 300803,0522 302277
Casablanca,MOROCCO RESERVATION SERVICES,"Résidence Mirage, n°6, 2è ETG, 167 Av Mehdi Benbarka, 20500, Borgogne",0520 779090,neant
Casablanca,MOROCCO TOURS,"Hôtel Royal Mansour, 27 rue sidi Belyout",0522 273819,0522 273836
Casablanca,MOROCCO TRAVEL ADDICT,"40, Bd Bordeaux, ETG 1, ESP A/3",0522 222420,neant
Casablanca,MOROCCO TRAVEL BUREAU,"237, Bd Zerktouni, Rond Point Racine",0522 392543,0522 395462
Casablanca,MOTIVATION & EVENTS,"N°23, Imm Taya, Lot les Arènes, Rue n°2, 5è étage Bureau n°23, Maarif",0522 945151,0522 256624
Casablanca,MOUMEN TRAVEL,"18 Bis, Rue Pierre Parent, Résidence Youssef",neant,neant
Casablanca,MOUNAN TRAVEL,"Rue Mer de Chine, Ain Diab",0522 797893,0522 797767
Casablanca,MS VOYAGE,"73, Bd Anfa, Angle 1, Rue Clos de Provence 6è ETG, Appt 601",0522 267400,neant
Casablanca,MTCF TRAVEL,"Angle Av. 2 Mars, Rue Amsterdam Imm 6, Etage 3, n°8",neant,neant
Casablanca,MTM TRAVEL & EVENTS,"55, Bd Omar Elkhiam, Rés. Longchamps, Imm B, n°1",0522 996601,0522 996610
Casablanca,NABA TOURS INTERNATIONAL,"2éme étage, Centre Commercial Riad Lalla Yacout, Angle Rue Mustapha El Maâni",0522 542917,0522 542918
Casablanca,NABIL TRAVEL & EVENTS,"Bd de la grande Ceinture, N°124, ETG2, hay Mohammadi",0522 604737,neant
Casablanca,NAJM TRAVEL,"Bd Makdad Lahrizi, Rés Al Boustane, n°171",0522 598437,0522 598437
Casablanca,NET VOYAGE,"N°1709, Av. Med 6, Jamila 3",0522 579898,0522 372359
Casablanca,NOMADA VOYAGES,"Imm 119, Bd la Résistance, 1er ETG, n°2",0522 318484,0522 318485
Casablanca,NORDING TRAVEL,"Tour des Habous, Av des FAR, ETG 8",neant,neant
Casablanca,OCEANIC AIR TOURS,"14, Av des FAR",0522 484540,0522 484534
Casablanca,OCTAV TOUR,"213 Bd Oued Daoura, El Azhari 1 El Oulfa",0522 252629,0522 236723
Casablanca,OLE VOYAGES,"30, Rue Saad Bnou Zarara, ETG 1, Maarif",neant,neant
Casablanca,OLIVE BRANCHE TOURS,"35, Rue Eloraibi Jilali",0522 223919,0522 260976
Casablanca,OPEN SKY TRAVEL,"17, Av des FAR",neant,neant
Casablanca,ORIENT VOYAGES,"Hay Al Qods, n°236 et 238, Bd Guernaoui, Sidi bernoussi",0522 768383,neant
Casablanca,OTRAVEL,"120, Bd Grande Ceinture, Imm Lilya 1 Etage 2, n°9, Aïn Sebaa",0522 355755,0522 355755
Casablanca,OVERSEAS TRAVEL AGENCY,"54, Bd Mly Youssef",0522 277621,0522 261520
Casablanca,PALMERAIE.BLEU VOYAGE,"Bd Med Bouziane, Résidence Farhatine, Imm 6, Magazin n°1, Essalama 3",0522 387538,0522 387560
Casablanca,PAPILLON VOYAGES,"Complexe commercial Romandie II, Bd. Bir Anzarane n°25, Maarif, 20100",522940160,neant
Casablanca,PARADISIA,"21, Rue Ahmed Touki, Av. Hassan II, Rez de Chaussée",0522 205765,neant
Casablanca,PEACE TRAVEL,"81, Bd Med Bouzian, GRP 4, My Rachid",0522 718784,0522 718769
Casablanca,PERFECT TRAVEL,"51, Bd Abdelkader Sehraoui, ETG 1 Hy Ennour, Sidi Othmane",0522 383285,0522 554417
Casablanca,PERFORMANCE EVENTS,"3, Rue de l'Epargne, Quartier Racine",0522 951999,0522 391008
Casablanca,PESCHAUD MAROC TRAVEL SERVICES,"299, Bd Mohamed V",0522 303722,0522 444351
Casablanca,PHARE TOURS,"38, Bd Driss Lahrizi, ETG 2",0522 475060,0522 272532
Casablanca,PHEBUS VOYAGES,72 Bd Zerktouni,0522 220188,0522 294341
Casablanca,PILOTE TRAVEL AGENCY,"47 rue des Faucilles angle 50, rue des Alpes Maârif",0522 989721,0522 989724
Casablanca,PLEIN CIEL,"38, rue Sidi Belyout 20000",0522 300004,0522 310536
Casablanca,PREFERENCE VOYAGES AGENCY,"24, Bis rue Guenaoui Mokhtar",0522 274156,0522 274061
Casablanca,PREMIUM TRAVEL,"05, Angle Rue Jaafar Ibnou Attia et Rue Ain Sidi Ali Bourgone, Anfa",0522 273633,0522 203522
Casablanca,PRESTO VOYAGES,"95, rue Allal Ben Abdellah",0522 317896,0522 540310
Casablanca,PRINTEMPS VOYAGES,"24, angle rue Strasbourg et Bd de Résidence Imm Casa1",neant,neant
Casablanca,PRIVILEGE VOYAGES,"46, rue Saad Ibn Abi Wakkas",0522 209615,0522 209556
Casablanca,R.C.I EVENTS & TRAVELS,"2, Rue Med Baamrani, Résidence Sara 2 Appt. 207, Sidi Belyout",0522 303032,0522 303046
Casablanca,RAFINITY TRAVEL AND EVENTS,"7, Angle Rue Sultan Abdelhamid,Rue Chouaib BenTayeb Chabaane,MagN°7A,Marif,Anfa",0522 366954,0522 366225
Casablanca,RANDONNEE VOYAGES,"84, Bd Mly Idriss 1er, Galerie la renaissance n°24",0522 860060,0522 860051
Casablanca,RANIA VOYAGES,"70, Angle Rue Ahmed Charci et Ali Abderrezak, Anfa",0522 949102,0522 942809
Casablanca,REAL TRAVEL SERVICE,"190, Rue Mustapha El Maani",0522 222701,0522 222705
Casablanca,REEMAN TOURS,"22, rue Sijilmassa, Quartier de la Gare Belvédère",0522 247626,neant
Casablanca,RENTACS TOURS  (EX: BATY VOYAGES),"Imm 13, Rue Alkassar, 1er Etage, n°2, Quartier Maarif",0522 252386,neant
Casablanca,RESTINGA TRAVEL & EVENTS  (RTE),"25, Rue Mohammed El Qorri",0522 204108,0522 661765
Casablanca,RIADS & VOYAGES,"152, Rue hadj Omar Riffi",0522 261464,0522 304437
Casablanca,RIDA AL AALAMIA,"199, Angle Av. Zerktouni et Rue Chellah B, n°13",0522 944475,0522 944471
Casablanca,RUD TRAVEL,"Centre Riad, 61 Av Lalla Yacout Angle Mustapha El Maani 2è étage N°78",0522 303354,0522 303354
Casablanca,RYAD TOURS,"Imm.8, Appt.7, Rue Mohamed Laaroussi Place la Victoire",0522 314707,0522 314723
Casablanca,SADRI TRAVEL,"Centre commercial Sidi Belyoute, Rue Mohamed Kamal, B4 n°30",0522 302034,0522 302081
Casablanca,SAFARCLICK.COM MAROC,"193, Bd de la Résistance, 3ème étage, Bureau n°C",0522 266969,0522 294466
Casablanca,SAFARIATES AL AHMADIYA,"Hay tarik, n°49, rue 42, Sidi Bernoussi",0522 754852,0522 754852
Casablanca,SAFI VOYAGES,"17, Av des FAR",neant,neant
Casablanca,SAHAB VOYAGES,"Amal 4, Rue 27, N°44, Sidi Bernoussi",225759167,225759167
Casablanca,SAIDIA TRAVEL,"34, Rue Najib Mahfoud, Rés Rahma Bureau n°4, Quartier Gauthier",0522 474757,0522 474704
Casablanca,SAMA EMIRATES TRAVEL TOURISME & CARGO,"Centre de Bouskoura, Imm Rachidi, n°13",0522 781109,0522 781109
Casablanca,SAMINE BROTHERS TRAVEL&SERVICE CO.GROUP,"18, Rue Moukhtar El Guernaoui",648959970,0522 678132
Casablanca,SAY TRAVEL,"Bd. Imam Ibnou Hazm, N°55, Hay El Qods, Sidi Bernoussi",522755756,0522 767202
Casablanca,SELECT TRAVEL & EVENT,"24, Bd Rachidi",0522 475800,0522 295290
Casablanca,SH VACANCES (EX:SOUMIA TRAVEL PLUS),"84, Mly Driss 1er, Galerie la Renaissance, n°18",0522 863532,0522 863580
Casablanca,SHANGHAI VOYAGES,"266, Bd de la Résistance, Rés Lmajd Mag n°2",0522 450102,0522 441162
Casablanca,SHEMS TRAVEL AND EVENTS (EX : SHEMS TRAVEL AGENCE DE VOYAGES),"Bd. La Corniche, Rés. Le Yacht, Imm. F, ETG 4, NR 131",0522 245270,neant
Casablanca,SHENZHOU VOYAGE,"6, Rue Abdelkrim Khattabi",0522 316868,0522 441843
Casablanca,SIDERAL TOURS,"43, rue Assakhaoui angle Bir-Anzarane",0522 949130/31,0522 949191
Casablanca,SIGMACO BUSINESS TRAVEL,"Résidence Lisstikrar 41, Bd. Zerktouni, Imm. B, n°27, Maarif",0522 209092,0522 209078
Casablanca,SIROCCO EVEN TOURS,"15, rue Arriachi Quartier Racine Anfa",0522 943124,0522 943123
Casablanca,SKY HOLIDAYS,Résidence Andaloussia Imm 15 n°5 rue Georges sand Maarif,0522 982259,0522 982304
Casablanca,SKY TOP TRAVEL,"126, Rue Med Smiha, ETG 5, Appt n°14 Rés Akhawaine",0522 542552,neant
Casablanca,SOCHATOUR,"71, Av des FAR",0522 310202,0522 314699
Casablanca,SORAA TOURS INTERNATIONAL,"14, rue Karatchi",0522 318623,0522 318667
Casablanca,S'TOURS,"4, rue Turgot Quartier Racine 20100",0522 361304,0522 362035
Casablanca,STRICT VOYAGES,"106, Lot Al Bader, Appt 13, Aïn Sebaa",0522 660885,0522 660885
Casablanca,SUN TOURS AND TRAVEL,"75, Driss Lahrizi",0522 202550,0522 472025
Casablanca,SUNRISE TRAVEL,"44, Av des FAR",neant,neant
Casablanca,SUPER TOURS,"3,  Rue de Foucauld",0522 203844,0522 203846
Casablanca,SYDNEY VOYAGES,"143 D, Rez de Chaussé, Bd de la Résistance ANG Arcachon",0522 541419,neant
Casablanca,TAHA TOURS,"9, rue Abdelkacim Ezzahraoui Quartier des Hopitaux",0522 298686,0522 205377
Casablanca,TAMARIS VOYAGES,"Hay Farah, n°389/393, Bd Chouaïb Doukkali",0522 834132,0522 833826
Casablanca,TARIK EL KHAIR VOYAGES,"N° 1 ET N°2 Mosquée Bab Essalam Rue Ahmed Faris, Av des FAR",0522 447448,0522 448537
Casablanca,TARIK ESSALAMA,"16, rue El Amraoui Brahim (ex Nolly)",0522 200444,0522 260718
Casablanca,TEAM TRAVEL SERVICES,20 Bd Rachidi,0522 225140,0522 225142
Casablanca,TENDANCE TOURS  (EX: MOROCCO CITY TRAVEL (EX:MOROCCO EVASION &,"42, Rue Mostapha El Manfalouti, ETG RC, Appt. MAG",neant,0522 297688
Casablanca,THE TRAVEL SHOP,"19, rue Chenier Rond point 16 Novembre",022 227305/06,022 227309
Casablanca,THURAYA TRAVEL & TOURISM (EX: LYS VOYAGES),49 Rue de Rome MAG,0522 985025,neant
Casablanca,TIP TOURS,"45, Bd Ghandi Mesd Yasmine",0522 941167,0522 941169
Casablanca,TISSIR TOURISME,"52, Bd Mohamed VI 6ème étage",0522 300509,0522 300509
Casablanca,TOURISMANIA,"75, rue Zerhoun",0522 273789,0522 274651
Casablanca,TOURISME MAROCAIN,"8, Bd Emile Zola",0522 304022,0522 309556
Casablanca,TOURISME SERVICES,"219, Rue Mustapha El Maani",0522 202111,0522 202113
Casablanca,TRANSATOUR MAROC,"40, Bd d'Anfa",522202521,522293310
Casablanca,TRAVEL CENTER,"34, Av. Hassan Seghir",0522 541585,0522 449800
Casablanca,TRAVEL EXPERT,"N°304, Bd Brahim Roudani, Rés Achifa, RDC",0522 985857,neant
Casablanca,TRAVEL GATEWAY (EX:EL KADI TRAVEL & TOURS),"N° 7, Angle Bd. Mustapha Al Maani, Rue Yasmine",0522 480099,neant
Casablanca,TRAVEL PLUS,"39, rue Omar Slaoui 1er étage n°2",0522 486536,0522 486938
Casablanca,TRAVELTODO,"264, Bd Ghandi, Résidence Jawhara, Appt n°13",0522 979670,0522 369847
Casablanca,TRIP AND GO,"Angle Bd Emile Zola et la Rue Saint Michel, Rés Taiba 4, Imm. A",522418979,0522 242739
Casablanca,TRIP'ON,"197, ANG Av Zerktouni, Rue Chella B n°11, ETG 4",0522 942099,0522 942098
Casablanca,ULTRA TOURS,"IMM 10, MAG N°5, Rue Mabillon, Val Fleuri",0522 236867,0522 236846
Casablanca,ULYSSE VOYAGES,"45, Bd Ghandi, Résidence Yasmine, n°49",0522 942245,0522 942226
Casablanca,UNI VOYAGES,"46, Rue de Foucauld",522203170,neant
Casablanca,UNITED TRAVEL AND TOURISM,"19, rue Abou Omar El Harti",0522 830033,0522 830035
Casablanca,UNIVERS VOYAGES (EX:MOUFID TRAVEL),"201, Bd d'Anfa",0522 942727,522394343
Casablanca,UTESS TOURISME,"27, Rue Jalal Eddine Essayouti Place du Nid d'Iris (ex Racine)",0522 367202,0522 367200
Casablanca,VAYA VOYAGES HOLLAND,"4, Rue Al Kassar, 3ème étage, Maarif",0522 230377,0522 230374
Casablanca,VENIZIA TRAVEL,"194, Bis Bd Abouchaib Eddouhali Chifa 2 Derb Sultan El Fida",0522 811631,0522 810271
Casablanca,VERY MOROCCO,"Angle Rue George Sand, Bd. Stendhal, Val Fleuri Rés. Benber, n°12",0522 472712,0522 271286
Casablanca,VIA INTER TOURING,"264, rue Abou Zaid Addadoussi Maarif",neant,neant
Casablanca,VIGIE VOYAGES,"92, Bd Mohamed V",0522 205677,0522 209232
Casablanca,VIP TRAVEL,"217, Bd Hachmi Filali, Lot Sidi Abderrahmane Bur n°5, 3è étage, Californie",0522 872525,0522 210859
Casablanca,VISIT MOROCCO,"N°3, Rue Hmed Ben Bouchta",0522 361632,0522 942338
Casablanca,VOLUBILIS VOYAGES,"15, Rue Jordanie, ETG 1, Benjdia",0522 5840120,0522 542153
Casablanca,VOYAGE INTERNATIONAL NUMERO 1,"85, Boulevard Driss Lahrizi, ETG 2",neant,05 22 20 38 77
Casablanca,VOYAGES 2000,Centre 2000,0522 271448,0522 263421
Casablanca,VOYAGES CLEMENT,"61, Av des FAR",0522 310419,0522 311616
Casablanca,VOYAGES ELAAZIZ,"Amal 4, Rue 58, n°24 Bernoussi",0522 735761,0522 735761
Casablanca,VOYAGES MILLE ET UNE NUITS,"33, Av. hassan Seghir, B2-8, 2è étage",0522 449001,0522 541478
Casablanca,VOYAGES NASSIM,"1713, Av Mohamed VI - CD",0522 576 401,0522 576423
Casablanca,VOYAGES PARADIS,"352, Bd de Bordeaux",0522 221133,0522 221240
Casablanca,VOYAGES SANS PAREIL,"72, Rue Moussa Bnou Noussair, Centre Commercial Galilée, Quartier Gauthier",0522 299111,0522 299131
Casablanca,VOYAGES WASTEELS,Place Gare Casa-Voyageurs,522246299,522313276
Casablanca,WAFA TOURS,"n°40, Rue 30, RDC, Groupe D3, Salam 1, Bernoussi",522682669,neant
Casablanca,WAFA TRAVEL,"26, rue de Toul angle rue Mustapha Al MAANI",0522 293936,0522 204974
Casablanca,WAKALAT BAB ESSALAM,"1681, Bd Med VI, Jamila 3, Cité Djemaa",0523 303074,0523 303076
Casablanca,WASHINGTON GENERAL D'EXCURSION,"Rue Moussa Bnou Noussaire Kissariat Errachid, n°19",0522 472888,0522 472886
Casablanca,WEB SYNERGY TRAVEL,"15, Rue Najib Mahfoud, ETG 1",0522 470104,neant
Casablanca,WEB TOURS,"169, Bd de la Résistance, Appt. 7",0522 542259,0522 542302
Casablanca,WHITE CAMEL TOURS,Espace Paquet 2ème étage n°206 Place Paquet Bd Mohamed V,0522 540546,0522 541006
Casablanca,WIB TRAVELS,"01, Rue Socrate et Abou Taour, Appt 07 Maarif Extérieur",0520 506161,neant
Casablanca,WIKI TOURS INTERNATIONAL,"52, Bd Med VI, 3è Etage",0522 447340,0522 447340
Casablanca,WISSAM TOURS,"52, Bd Abdelmoumen Résidence Manar",0522 230095,0522 230300
Casablanca,WORLD TRAVELS PROSPECTIONS,"N°2, Imm B GH1, Riad Bernoussi 2, Sidi Bernoussi",0522 738627,0522 738627
Casablanca,WORLD VOYAGE,"Bd Bir Anzarane, Romandie II, Tour Oualili n°4, Maarif",0522 940619,0522 940638
Casablanca,WORLDWIDE TRIPS AND TOURISM AGENCY,"Bd. Hassan Sghir, Imm. 97, Appt. 126, 4è étage, Sidi Belyout",0522 307878,0522 307272
Casablanca,XPLORE TRAVEL (EX: SOCIETE RISSALA VOYAGE),"68 Bd Abdellatif Ben Kaddour, RDC n°8 Rés Wafa Q Racine",0522 458796,0522 327205
Casablanca,YACOUB EL MANSOUR VOYAGES,"22, Centre Commercial Dar Assalam, Angle Bd Yacoub El Mansour et rue Larache",0522 361270,0522 399455
Casablanca,YAS-MOROCCO TRAVELS,"N°235, Bd Yacoub El Mansour, Beauséjour",neant,0522 981824
Casablanca,YOU TRAVEL,"N°134, Av. Panoramique, Aïn Chock",0522 506291,0522 874845
Casablanca,ZGUENDI TRAVEL AGENCY,"266, Bd Mohamed V",0522 448780,522448779
Casablanca,ZINEB VOYAGES,"Rue Lattifi El Mekki, n°8",0522 310048,0522 310050
Casablanca,ZIRAOUIA TOURS,"59, rue d'AGADIR",0522 295136,0522 223276
Dakhla,ARAB HOLIDAYS,Av. Imlili Hay El Matar,0528 931313,0528 931313
Dakhla,DAKHLA REGENCY TRAVEL,"Av. El Walae, Hôtel Sahara Regency",0528 931555,0528 897045
Dakhla,DAKHLA TOURS,Avenue Mohamed V,neant,neant
Dakhla,DEFI TRAVEL,"Hay El Massira II, Av. Ahmed Ben Chekroune n°156",0528 932585,0528 932585
Dakhla,RIO DE ORO VOYAGE II,"Rue El Masjid, Massira 1",0528 931689,0528 931689
Dakhla,SAWA VOYAGE,"Av. El Walae, Angle Rue Lagouira n°1",0528 898046,0528 898045
El Jadida,ACCORD TRAVEL,"Lot Essalam 1, N°397, RDC",neant,0523 375785
El Jadida,AZIZA DU TOURISME ET VOYAGE,"Angle Route Doukkala et Derb El Ghaouzi, n°2, Etage 1 -AZEMMOUR-",0523 382940,0523 382930
El Jadida,MAZAGAN VOYAGES,"50, Av. Fquih M'Hamed Errafii",0523 355134,0523 355134
El Jadida,RICORDI VOYAGES,"Av. Med VI, Centre Marhaba",0523 355969,0523 352296
El Jadida,TRAVEL CITERNE INTERNATIONAL,Place El Hansali Imm n°62 Appt n°6,0523 353518,0523 353806
El Jadida,TRAVEL SQUARE,"Av. Jabrane Khalil Jabrane, Imm GHK27 Bureau n°7, 3è étage",0523 390040,0523 353373
El Jadida,VEGAS TOURS,"7, Bd El Nakhil, Imm El Mourabittine",0522 407360,0522 407351
El Kelaa des Sraghna,AGENCE ZAHRANE,"N°151, Complexe Economique et Social",0524 220431,neant
El Kelaa des Sraghna,ASFAR SARGHINI,"Centre El Attaouia Garage n°16, El Attaouia",0524 135149,0524 135149
El Kelaa des Sraghna,RAMI VOYAGES,"N°91, Av Imam Malik, 2è étage N°4",0524 414790,neant
Errachidia,AL JANOUB ADDAHBI,"N°5, Bd Bir Anzarane",neant,0535 574343
Errachidia,DUNES D'OR VOYAGES,N°1 Av Med VI (Ex Dakhla),0535 792020,0535 792020
Errachidia,MARRUECOSCOM,"Ksar Hassi Labiad, Bp 120, Taous Rissani, Merzouga",neant,0535 576324
Essaouira,APOSTROPHE VOYAGES,"N° B2, Complexe Touristique Bin Al Aswar",0524 474688,0524 784524
Fès,3T TRAVEL,"5è étage, N°63, Bureaux Al Madina 3, Rue Asila Atlas",0535 625544,neant
Fès,ADH VOYAGES,"Route Ain Chkaf, rue des écoles, Lotissement Lahlou Résidence Kenza",0535 600484,0535 602795
Fès,AGENCE AL KAWAKEB VOYAGES,"31, Av. St Louis, RDC, Cote Zaza",0535 693858,0535 694270
Fès,AL BIR VOYAGES,"12, Rue Ahmed Hiba, BD Chefchaouni-VN",0535 943435,0535 943435
Fès,ALBORAQ VOYAGES,"2, rue Omar Ibn Khattab, Av. Allal Ben Abdellah, (Ex rue Mohamed Ghazi)",0535 940088,0535 940099
Fès,ANBAR HOLIDAYS,"4è étage, Lot n°39, Lots Parc Champs de Course",0535 604286,neant
Fès,AUTRES VOYAGES,"N°14, étage 3, Av des FAR ATLAS",0535 734755,0535 734758
Fès,AZUR VOYAGES,"3, Av. Lalla Meryem",0535 625115,0535 650305
Fès,CAPITAL TOURS,"45, Av Hassan II",0535 626363,0535 626363
Fès,CATHYA VOYAGES,"31, Bd Chefchaouni",0535 931023,0535 651954
Fès,COSTA VOYAGE,"Espace Bel Air, Bur n°9, ETC 1, Av Allal Ben Abdellah, Rue Abdelaziz Taalabi-VN",0535 734288,0535 734069
Fès,ESPACE VERT TRAVEL (SARL) AU,"N°44, Bureau 8, 1er étage, Rue Brahim Roudani",535651841,0535 651896
Fès,FES ART ET CULTURE TRAVEL,"14, Av. Med Karrat, Ville Nouvelle",0535 932119,0535 932145
Fès,FUTUR VOYAGES,Angle rue Hassan Bnou Tabit et Bnou Azzouz. Champs de course VN,0535 653800,0535 653813
Fès,GM2 TRAVEL,"N°6, 2è étage, Imm Fès Carrefour, Av des FAR",0535 658446,0535 644150
Fès,GOLDEN TRAVEL TOURISM AGENCY (ex:ABOUAAM,"Mag n°2 RDC, Imm 2, Rue Lakhdar Ghilane Bd Chefchaoueni VN",0535 930402,0535 930397
Fès,KARIMA VOYAGES,"106, Bd Mohamed V",673 16/47,0535 930668
Fès,KETTANI VOYAGES,Magasin N°9 Rue Mohamed Diouri VN,0535 621990,0535 621990
Fès,KING'S HOLIDAYS,"Rue Ahmed Chbihi, Av des FAR, Imm 3, App 4 VN",0535 930499,0535 943455
Fès,MRANI TRAVEL & TOURS,"9999, Lot Adarissa 2, Appt n°11, Imm. D11, Route Ain Chkef",0535 604630,0535 967260
Fès,N.J.H TRAVEL,"1, rue Khalil Matrane, Av. Allal Ben Abdellah",0535 624006,0535 624007
Fès,NATURE VOYAGES,"Ville Nouvelle, Ahmed Loukili n° 4",0535 625251,0535 940277
Fès,NOUVELLES DESTINATIONS TRAVEL,"Av. Med V, Imm Bureau Al Madina, n°5, 1er étage",0535 621402,0535 621402
Fès,NUMBER ONE,"41, Av Med Slaoui, VN",0535 621234,0535 943640
Fès,OBJECTIF MAROC,"9, Rue de Turquie",0535 652816,0535 621776
Fès,OUSSADEN TOURS,"Place de l'Atlas, 12 Bis, Rue Omar Benjelloun",0535 930061,0535 930061
Fès,PLAN-IT MOROCCO,"N°6, Bd Ahmed Mekouar, Bab Al Hdid",0535 638708,
Fès,RIAD FES TOURS,"DRC, N°36, Bd Med V",0535 942295,0535 942295
Fès,SAISS VOYAGES,"7, rue Mokhtar Soussi, Bd Med V",0535 940402,0535 940410
Fès,SAT VOYAGES,"Imm. Mamda, Rue de Lybie, n°1",0535 652276,0535 652277
Fès,SCENIC VOYAGES INTERNATIONAL,"7, Rue Lalla Amina, Résidence Belvédère, Magasin n°3",0535 944297,0535 638230
Fès,SOLAIR TRAVEL,"23, Bd Chefchaouni",0535 622926,0535 622987
Fès,SWEET VOYAGES,"19, Bd Chefchaouni",0535 653810,0535 651151
Fès,TAIBA DESTINATION,"3, angle avenue des FAR et Rue Ahmed Chbihi",0535 650 121,0535 652 576
Fès,TAK VOYAGES,"41, Bd Med V",0535 624550,0535 622736
Fès,THE TRAVEL SOURCE,"8, Rue la Poste Batha",0535 637611,0535 638230
Fès,TRAVEL YALLA MOROCCO,"Bureau n°2, Bureaux les IRIS, Etage 1, Champs de Course VN",0535 944076,0535 944076
Fès,UNLIMITED TRAVELS (UTRAV),"69, Rue 6 Saada 2",0535 940910,0535 940910
Fès,ZALAGH VOYAGES,"23, Bis Avenue de Palestine",0535 652069,0535 652062
Fès,ZERRIFI VOYAGE,"Mag n°4, Rue Med Diouri, VN",0535 652794,0535 652794
Fkih Ben-Salah,EL HATNIA VOYAGES,"79, Av Caid Ben Amran",0523 434038,0523 435198
Fkih Ben-Salah,KROUD VOYAGES,279 Bd Allal Ben Abdellah,0523 432452,0523 432465
Fkih Ben-Salah,LUCKY TOURS,"N° 2825, Bd La Marche verte",0523 437333,0523 438896
Fkih Ben-Salah,TADLA TRAVELLING,"23, Bd Hassan II BP128",0523 435439,0523 434958
Fkih Ben-Salah,VOYAGES GHAZZA,"Bd Hassan II, N°83",0523 438702,0523 438700
Fnideq,BLUE SKY TRAVEL AGENCY,"Route 9 avril, Souani, Martil, Préfecture de M'diq",0539 970350,0539 715757
Fnideq,VIAJES SEPTEM,"Lot Bab Sebta, Av 3, Rue 7, n°25, RD CH",0539 675150,0539 675159
Guelmim,3S- TRAVEL,"212, Lot Sahara",0528 870856,0528 870842
Guelmim,PLAGE BLANCHE TRAVEL,"N°100, AV. Mly Rachid",0528 870422,0528 870420
Guercif,GUERCIF VOYAGES,"38, Bd Youssef Ibn Tachfine",0535 200270,0535 676238
Inezgane,AJIAD TRAVELS,"1er Etage, Imm 141, Appt n°2, Av Hassan II, Lot Al Jihadia, Dcheira",0528 334353,0528 836742
Inezgane,ALMAJD VOYAGE   EX:(TRAVEL YOUCHAR),"N°28 Rue Chtouka, 1er étage",0528 336167,neant
Inezgane,BENDAOUI TRAVEL,"Appt n°4, 2è étage, Imm Atlas, Av. Med V Amougay Dcheira",0528 838390,0528 838270
Inezgane,CREME SOLAIRE,"N°17, rue des Ecoles",0528 833232,0528 833231
Inezgane,INEZGANE VOYAGES,"12, Bd Med V",0528 832079,0528 832084
Inezgane,SAULE TOURS,"Angle Av. Hassan II et Rue Ighrem, n°22 Kissariat Al Baraka, Hay Hassani",0528 336868,0528 336866
Inezgane,SOCIETE AMICAL TOURS,"N°39, Imm de Commerce, Av. Hassan II Aït Melloul",0528 249797,0528 249797
Kasbat Tadla,SOCIETE YOUSRAN VOYAGES,"Lemhirzet, Bloc n°26 Bis",0523 418895,0523 418892
Kénitra,AJI TRAVEL,427 Angle Av. Med v et Med Diouri n°13,0537 366588,0537 366333
Kénitra,AL HAMD ASFAR,"Angle Mly Abdelaziz et Mly Hfid, Rés Dikra, Bureau n°3",808540205,neant
