Province Name,Denomination,Address,Tel,Fax
Kénitra,ALL VOYAGES AND EVENTS,"Rés Tanagra Centre 262,Angle Av Med V,Rue Med Hansali,Rue Salah Eddine Bur n°4Imm B, 1er étage",0537 395960,neant
Kénitra,ALQURSHI AZELARABE VOYAGE,Bur n°5 Angle 26 Rue Abi Zaraa 39 Bd Mly Abdelaziz et 86 Av Mly Abderrahmane Imm B,0537 395595,0537 395595
Kénitra,ASWAR VOYAGES,"Mag 4, Rés Ennassim, Angle Av Med V et Abou Bakr Essedik",0537 371703,0537 371704
Kénitra,AYUR TRAVEL,"Mag n°6, Rés Maamora 6, Angle 115 et Rue maamora et 55 Rue Med El Amraoui",0537 324665,0537 324759
Kénitra,BOUNOUAR TOURS,"18, Avenue Tarik Ibn Ziad",0537 374124/26,0537 374100
Kénitra,HISTORIC VOYAGES,Angle Av Med V et rue Sebta,0537 375942,0537 360874
Kénitra,INEDIT TRAVEL,"454, Av Med V, Rés Magnolia, Bureau n°1",0537 367750,0537 324841
Kénitra,KAMI TRAVELS,"Angle Av. des FAR N°44 et Rue Maamora N°162 Bur N°8, Rés les deux palmiers",0537 374095,0537 374094
Kénitra,LE VOYAGEUR TRAVEL,"Bureau N°5, Rés Camilia, Av. Med Diouri, Rue Med Abdou",808513737,808513737
Kénitra,LOYAL TOURS,"N°8, Angle Av Mly Slimane et rue Amr El Ass, Bur n°4",0537 395700,0537 394333
Kénitra,MAM TRAVEL,"4, Rue Mansour Eddahbi, Résidence Aziza, Bureau à l'entre Sol n°4",0537 366412,neant
Kénitra,MORTIER,"413 Avenue Mohamed V et Angle Av, Mohamed Diouri BP 244",0537 376040,0537 376470
Kénitra,OUEST AMATOURS,"Rue Moulay Abdellah, RDC n°31",0537 363420,0537 363403
Kénitra,REMAS VOYAGES,"Bureau n°5, Entrée B, Av Med V, Angle Rues Salaheddine et Med Hansali, Tanagra Mall",0537 325702,neant
Kénitra,RISSALA TRAVEL (EX: AGENCE RISSALA DE VOYAGE ET DE TOURISME),"160, Av. Med Diouri, Bur N°1",0537 375858,0537 375858
Kénitra,SEBOU VOYAGES,"3, rue Al Moutanabi, Imm Samia 5",0537 378236,0537 379343
Kénitra,SIROCCO VOYAGES,13 Avenue Khalid Ibn Al Walid RDC n°1,0537 372401,0537 360843
Kénitra,SMACT VOYAGES,39 rue My Abdellah,0537 371730,0537 375108
Kénitra,TIZI RANDONNEES,46 Ave My A bderrahmane Imm Essalam n°1,0537 375354,0537 374009
Khénifra,A-NNABAT AL HASSAN TOURS,"N°80, Complexe Al Arz, Bd Med V",0535 386909,0535 386909
Khénifra,CEDRE TRAVEL,"Bd Med V, N°1, Rue 4 Hay Ennajah",0535 588555,0535 384468
Khénifra,ZAYANE VOYAGES,"80-81, Complexe Commercoal les Cèdres, Av, Med V",0535 587054,0535 383354
Khmisset,CENTURY TRAVEL,"N°57, AV. Med V",0537 556377,0537 556377
Khouribga,AL GHOFRANE VOYAGES,25-27 Rue Lemfasis Al Masjid Alatiq,0523 567603,0523 567087
Khouribga,ASFAR ALMOSTAFA,"141, Bd Med VI",0523 565184,0523 565184
Khouribga,CARLTON TRAVEL AGENCY,"163, Bd Zellaka",0523 490935,0523 490936
Khouribga,EL MOHAJER VOYAGES,"16 Bis, Bd Med 6",0523 564991,0523 564991
Khouribga,EL QODS VOYAGES,"1005 Bis, Bd El Moukawama El Qods",0523 563333,0523 562233
Khouribga,ETOILE DU CENTRE VOYAGES,"Angle Place El Moujahidine, Rue du Souk",0523 566678,0523 564712
Khouribga,GUOUMAR TOURS,"36, Rue Marrakech",0523 492439,0523 490515
Khouribga,KHOURIBGA VOYAGES,"3, Rue d'Agadir",0523 492637,0523 492637
Khouribga,SOCIETE GENERALE DE TOURISME ET DEVOYAGE,"106, Bd Med V Oued Zem",0523 411212,0523 411212
Khouribga,WASSIM VOYAGES,"Bd Brahim Roudani, n°70, Appt n°2, Bloc A Hay El Wifak",0523 565614,0523 565616
Khouribga,WHITE TRAVEL,"N°30, Bd Med 6, Hay Moukawama",0523 564506,0523 564506
Ksar El Kébir,LABYK VOYAGES,"N°24 Lôt Boulaiche, Av. de la Gare, 1er et 2è étage",0539 903333,0539 908601
Laayoune,ARREMAL TRAVELS,"Avenue Mekka n°64, Imm. Amekrane",0528 981202,0528 981204
Laayoune,BAIDA TRAVEL,Avenue de la Mecque n°52,0258 890967,0528 890968
Laayoune,BUREAU SAHARIEN DU TOURISME,"6, rue Kairaouane",neant,neant
Laayoune,DISCOVRY HOSPITALITY,Hotel Al Massira Avenue de l Meque BP 189,0528 894225,0528 890962
Laayoune,DRISSI TOUBBALI ASSFAR,Av. de la Mecque n°312,0528 891112,0528 891164
Laayoune,EL SAHARIANO TRAVEL,"Angle Bd Mekka et Rue 20 Août, en face CTM",0528 981212,0528 999999
Laayoune,FADEL SAHARA TOURS,"Hay Mly Rachid, Av Med Zerktouni, Rue Choukani Propriété Chrife n°1, RDC",0528 891993,0528 891994
Laayoune,FAYDOUL TOURS,"Av. de la Mecque, N°200",0528 890707,0528 890707
Laayoune,KASSAMAR TOUR,"N°27 Av de la Mecque, Route Es Semara",neant,neant
Laayoune,KHAOULA TOURS,"Av de la Mecque, Imm 311",neant,neant
Laayoune,OSCAR VIAJES,Av. El Amir Mly Abdellah n°36,0528 990239,0528 990240
Laayoune,SAGUIA TRAVEL,Rue Atar n°10 Bis,0528 893588,neant
Laayoune,SAHARA CANARIA TIRASS,Av. de la Mecque n°181,0528 894125,neant
Laayoune,SAHARA TURISMO,"Bd Moulay Ismail, N°69 et 71",0528 990900,0528 990900
Laayoune,SAHARA VOYAGES,"Avenue de la Mecque, 98, rue Mohammed Zerktouni BP. 193 Imm Joumani",0528 994737,0528 994233
Laayoune,SAHRA SARIA,"Avenue Yacoub El Mansour, n°8 Quartier Administrati",0528 890136,0528 890143
Laayoune,SAHRAWI TRAVEL,"Av Essmara Kaisariyate Ddish, Quartier Khat Ramla 01",0528 980000,neant
Laayoune,SKY PLUS,"Av Oum Saad N°34, Imm Saada, Hay Idari",neant,neant
Marrakech,360 S,"1 Av. Med VI, Résidence Ali, Entrée D 2è étage, Appt 5",0524 457668,0524 457658
Marrakech,AB INCENTIVE,"Bd Abdelkrim El Khattabi, Complexe Al Moutassalli Imm1, 1 étage, Appt 1",0524 301167,0524 301175
Marrakech,ABERCROMBIE & KENT MOROCCO S.A,"Av Yacoub El Mansour Lot El Ghraria Rés. Al Amira III Bureaux n°44,45,46et 47",0524 440444,0524 457721
Marrakech,ACCESS TOURS & TRAVEL INTERNATIONAL,"Rue Ibn Aîcha, Appt n° 2, Guèliz",0524 438536,0524 435879
Marrakech,ACHAMIYA VOYAGES,"113, Av. Abdelkrim Al Khattabi, Imm Al Mohandiz Bloc A, 4è étage, n°14",0524 422043,0524 430016
Marrakech,ACROSS MOROCCO,"Rue Mauritania, Imm Tawakil Appt 10, 4ème étage Guéliz",0524 434243,0524 430060
Marrakech,ADRAR AVENTURE,"N° 111, cité Saada Menara 40000",0524 435663,0524 435682
Marrakech,AEROPORT ASSISTANCE SERVICES,"19 Angle Rue Ibn Aïcha et Med El Bequal Rés Yasmine, Appt n°5, Etage 2, Guéliz",0524 433591,0524 433590
Marrakech,AFRIC ASFAR,"189, Av Mohamed V, 40000",0524 437194,0524 437045
Marrakech,AGENCE DE LOISIRS MAROCAIN,"Rés Yasmine, Bd Cheikh Rabhi Appt n°14, 2è étage Camp El Ghoul, Guéliz",0524 438047,0524 438046
Marrakech,AGENCE DE VOYAGE QAFILAT TAYBA,"Bureau n°1, Mosquée Khalid Ben Alwalid Lotissement Sanaoubar",0524 335508,0524 335505
Marrakech,AGENCE DE VOYAGES AUTHENTICA (TOURISPORT,"213, Bd Med V, Appt n° 31, 4ème étage",0524 448139,0524 448165
Marrakech,AL MOMAYAZA ASFAR,"243, Av. Allal El Fassi, Unités n°1, 1er étage",0524 301111,0524 312223
Marrakech,AL OMDA VOYAGES,"N°1173, Mhamid 5",0524 013150,0524 439656
Marrakech,AL SAKEENA TRAVEL MAROC,818 Lotissement Al Azzouzia,0524 355691,0524 343225
Marrakech,ALAQEQ VOYAGE,"N°7, Imm Wafa, Av Allal El Fassi",0524 055843,0524 055843
Marrakech,ALDO TOURS,"55, Av Mohamed V, Appt n° 13, 2ème étage Guéliz",0524 430105,0524 430150
Marrakech,ALGERIA TOURS,"24, Av. Abdelkrim El Khettabi",0524 434793,0524 434794
Marrakech,AM EVASION,"N° 7, résidence Al Mourad Av Med V Guéliz",0524 439699,0524 439723
Marrakech,AMALOU VOYAGES TREKKING,"Bureau n°1, Etage 2 n°563 Lotissement Al Massar",0524 432221,0524 432242
Marrakech,AMAZIGH TOURS,Av Hassan II Guéliz,0524 335467,0524 335085
Marrakech,AME D'AVENTURE,"Lot Semlalia n°81, Rue Tensift, Guéliz BP: 977",0524 439025,0452 432006
Marrakech,AMIRAL VOYAGES,"44, Bd Al Ikaa Aïn Mezouar, Appt n°3",0524 491601,0524 491638
Marrakech,ANANDA VOYAGES,"29, Rue yougoslavie 4ème étage Guéliz",0524 430020,0524 430026
Marrakech,ANDO TRAVEL,"Boutique n°9, Av Allal Al Fassi Imm Al Moutassali, n°26",0524 291479,0524 330999
Marrakech,ANERGUI VOYAGES,"Av. Prince My Abdellah, Résidence Bab Doukkala D1, n°15",0524 420432,0524 420446
Marrakech,ANFA TOURS,"10, rue Loubnane A15, Guéliz 40000",0524 430519,0524 430516
Marrakech,ANGADS VOYAGES,"Appt n°1, Imm Ali C Av. Med VI, Guéliz",0524 435214,0524 435204
Marrakech,ANOUAR VOYAGES,"132, Rue Mohamed El Bequal, Guéliz",0524 446070,0524 446011
Marrakech,ANWAR AL HIMAM,"Av Prince My Abdellah, Rés Anasse Majorelle, 4è étage, Appt N°87, Bab Doukkala",0524 447144,0524 447144
Marrakech,APADANA TRAVEL AGENCY,"55, Lot Hassania, Imm Zineb Drissia, Appt. 4, Guéliz",0524 449001,0524 449002
Marrakech,AS VOYAGES,"26, Av. Allal El Fassi, 1er étage, Appt n°16",0524 302905,0524 302938
Marrakech,ASFAR TASSAOUT,"16, rue yougoslavie Passage ghandouri n° 48",0524 439393,0524 436741
Marrakech,ASSL TOURS,61 Rue Yougoslavie Imm C 3è Etage Appt n°9,0524 446166,0524 446166
Marrakech,ATLAS AND SAHARA TOURS,"Centre Imlil, RDC APT 1, Imlil Assni",0524 484911,0524 484911
Marrakech,ATLAS MAROC RANDO,"18, rue du Colonel Gazeilles",0524 439829,0524 439822
Marrakech,ATLAS OUTDOOR,"253, Sofia Lot Targa",0524 496461,0524 395441
Marrakech,ATLAS SAHARA EXPLORE,"N°36, RDC Khalil I, Mhamid",0524 202580,neant
Marrakech,ATLAS SAHARA TREKS,"101, étage 1, Assif C",0524 313905,0524 313905
Marrakech,ATTAWHID VOYAGES ET TOURISMES,N°209 Mhamid 3,0524 379799,neant
Marrakech,ATTENDANCE MICE,"74, Av Hassan II, Rés Elizabeth 5è étage, Plateau n°13",0524 431703,neant
Marrakech,AUTHENTIC JOURNEYS MOROCCO,"Av. Allal El Fassi, Rue Mouslim Imm E Appt 3, 1er étage",0524 422703,0524 422704
Marrakech,AVENTURE BERBERE,"Immeuble Hamdane, n° 41 Av. Hassan II",0524 420740,0524 421415
Marrakech,AVS TOURISME,"5, rue Sourya, Guéliz",neant,neant
Marrakech,BADDOU VOYAGES,"Belle Vue 2, Rue Sergent Levet, Camp El Ghoul",0524 423839,0524 438151
Marrakech,BADRA VOYAGES,"6 bis, résidence Al Mourad, Av Med V Guéliz",0524 420217,0524 422550
Marrakech,BALABIL VOYAGE,"Appt 33, Résidence Assafaa, Av Allal Al Fassi",0524 363013,0524 363011
Marrakech,BARIGOU VOYAGES,"Av. Prince My Abdellah, Imm Mehdi, Appt 19",0524 423099,0524 439656
Marrakech,BATOUL VOYAGES,"Parc Yasmin GH11, Imm 9 Appt 13 Tamansort Harbil",0524 409118,0524 409118
Marrakech,BOARDING PASS DMC,"Centre d'Affaire, Espace Al Abrar, n°24 Yaacoub ElMansour, Plateaux Bur n°25, ETG4",0525 096095,0525 096090
Marrakech,BOUGUEMMAZ TRAVEL,"N°27, 1er étage Rés Drarga, Av Yacoub El Mansour Cité Boukar",0524 434038,0524 434038
Marrakech,BUSINESS CLASS CONSEIL,"C8, Résidence Mohandiz, 113, Av. Abdelkrim Khattabi",0524 448406,0524 448503
Marrakech,BUSINESS CLASS EVENTS,"Résidence de l'Hivernage Appt 5, Av Mohamed VI, Guéliz",0524 448409,0524 448503
Marrakech,BYZANCE TRAVEL,"55, Rue Souria, Appt n°8, Guéliz",0524 433174,0524 433517
Marrakech,CALECHE VOYAGES,"213, Av Med V, Appt n°26",0524 435656,neant
Marrakech,CHAFAI VOYAGES,El Azzouzia 2389,0524 358135,neant
Marrakech,CHASSAMIR ESCAPADES,"65, Av Mohamed V",0524 449787,0524 435308
Marrakech,CHECK INN MOROCCO,"N°213, Av Med V, Appt n°16, Guéliz",0524 447319,neant
Marrakech,CHERKATOURS,43 Bd point de la Rnaissance - Guéliz,0524 439270,0524 439268
Marrakech,CLUB VOYAGE EVASION,"Bureau N°9, Imm 2, Av Allal Al Fassi",0524 332452,0524 332458
Marrakech,COBBLESTONE PRIVATE TRAVEL MOROCCO,"2, Rue Angle Rue Sergent Levet et Ferkla 1er étage, n°5",0524 457626,0524 457629
Marrakech,COBRATOURS,"43, Bd Zrektouni - Guéliz",0524 421308,0524 420002
Marrakech,CONCEPTOURS,"220, Av Mohamed V R2sidence Badr - Guéliz Appt n°20",0524 438525,0524 437802
Marrakech,CORAL TRAVEL AGENCY,Rés Meriem Appt n°9 Massira 1 C 529,0524 344779,0524 392515
Marrakech,COSMIC TRAVEL,"Bd Allal Al Fassi, Lot Hamza 43, Imm Chaouki 4, Appt 4, 2ème étage",0524 291616,0524 291617
Marrakech,CREATION PLUS,"Kawkes center, 42 bis rue Imam Echafai",0524 436950,0524 436557
Marrakech,CREATION VOYAGES,"Imm Mouhtij, n°166 Bd Abdelkrim Elkhttabi 2è étage, Apt n°9",0524 457985,0524 457985
Marrakech,CREATIVE INCENTIVE,"Menara Lieudit, El Azzouzia, Appt A1, Bab Targa",neant,neant
Marrakech,CREATIVE TOURS,"Imm Bd Doukkala Bloc D, n°6",0524 439211,0524 439249
Marrakech,CULTURE NATURE VOYAGES,Av Oumrabia Imm Nakhil App n° 19 - Guéliz,0524 439866,0524 439873
Marrakech,CYNAB VOYAGE,"Hassan II, Koutoubia Centre 2, Bureau n°23",524436956,neant
Marrakech,DAOUDI VOYAGE,"N°20, Rés Henrie, 13, Rue Ibn Cadi, Quartier Industriel",0524 421957,neant
Marrakech,DEEP SOUTH TRAVEL,"13, Place Oqba Bnou Nafia, Imm Roxe",0524 386084,neant
Marrakech,DELIGHT EVENT MANAGEMENT,"Bd Med V Res City, Bureau D9 Etage 5",0524 423282,neant
Marrakech,DESTINATION MANAGEMENT MOROCCO,"Résidence Amina, n°17, Rue Khalid Bnou Walid Guéliz",0524 422680,0524 422680
Marrakech,DIFFA TOURS,"2, Rue Ibn Aicha Imm BELIA",524434879,524430650
Marrakech,DIYAR TOURS,"N°95, Rue Fatima-Zohra Rmila",0524 377726,0524 377726
Marrakech,EASYGO TOURS,"Imm Essaâda 155, Aïn Mezouar 3è étage, Appt 12, Bureau n°1",0524 379225,0524 379225
Marrakech,EDEN TOURS INTERNATIONAL,"46, Rue Ibn Abdoune Appt 4",0524 447411,0524 447140
Marrakech,EM VOYAGES,"33, Passage Ghandouri, Bd Zerktouni",0524 435254,0524 435284
Marrakech,ENTOURAGE TRAVEL INCORPORATED,"Rue 11 Janvier, Centre d'Affaire Fatima-Zahra, Imm n°1, 1er étage, Appt N°3",neant,neant
Marrakech,EPIC MOROCCO TRAVEL,"Rue Cheikh Rabhi, Res Guéliz Imm A n°14 Etage 5",524438272,524438272
Marrakech,ESCALES SIGNATURE,"80, Rue Ouad El Makhazin, Res Lafrasouk n°3, 1er étage",0524 426326,neant
Marrakech,ESCAPES & CO TRAVEL,"N°14 Imm Atlas Center, Rue Yougoslavie Guéliz",0524 436936,neant
Marrakech,EVENTS MOTION,"Résidence Arrabii 1, Appt n°5, Sidi Youssef Ben Ali",0524 401212,0524 401212
Marrakech,EXCEL TOURS,"Quartier Essada, 156, Imm les Cerisiers -Ménara-",0524 368000,0524 431375
Marrakech,EXCEL TRAVEL MOROCCO,"N°484, Q I Sidi Ghanem, Bureau n°7",0524 356114,0524 356114
Marrakech,EXCLUSIVE INCOMING,"Appt n°12, 3è Etage, Rue Ibn Toumert n°5 Bis Imm Belkziz, Guéliz",808531936,808531936
Marrakech,EXCLUSIVELY MOROCCO,"Place du 16 Novembre Rés Plaza Imm D1 3è ETG Bur n°5 et 6, Guéliz",0524 435584,neant
Marrakech,EXPLORING MOROCCO TRAVEL,"Rés Drarga, Av Yacoub Al Mansour, 3è étage, Appt n°49, Guéliz",0524 422147,neant
Marrakech,EXTRA MILE,"Résidence Najd, Imm C 16, Appt 6, Mabrouka",0524 423294,0524 432998
Marrakech,FARAH ASFAR,"Imm 16, n°4 Mouzdalifa Arset Sinko",649448851,649448851
Marrakech,FAS INCOMING SERVICES,"55, rue souria, Guéliz",0524 448016,0524 420758
Marrakech,FAT VOYAGES,"56, Boulevard Moulay Hassan Kawkab  Centre, Guéliz",0524 439560,0524 446803
Marrakech,FIRST CLASS TRAVEL INTERNATIONAL,Angle Bd Mohamed V et Av Hassan 1er n°7 Bloc B  Imm Siham 2,0524 430331,524430284
Marrakech,GENESIS TRAVEL SERVICE,"Imm. Espace Bureaux El Yasmine, n°27, 28 et 29, 3è étage, Av. Abdelkrim Khattabi",0524 351450,0524 437120
Marrakech,GEO HOLIDAYS,Rue Cadi Ayad et Rue Mauritanie Résidence Al Manar 4B B6 Bis,0524 420032,0524 448675
Marrakech,GHARNATA TOURS(Ex Red Castle),"Av Allal El Fassi, Ensemble Dar El Hamra Immeuble B, N°2",524422290,0524 422293
Marrakech,GLOBAL INTERNATIONAL TOURS,"312, Av Allal El Fassi, Dar El Hamra, Imm n°1",0524 306158,0524 306736
Marrakech,GOLDEN PALMS TRIP,"23, Résidence Tissir, Quartier Youssef Ibn Tachfine Guéliz",524431368,neant
Marrakech,GSN VOYAGES,"22, Av Prince My Abdellah, 2è étage Bur n°10",0524 458 764,0524 458 764
Marrakech,H & L TRAVEL,"Appt 129, Bloc L, Etage 2, Rés Al Bassatine, Av. Guemmassa",0524 370878,neant
Marrakech,HABTI VOYAGES,"159, Bd Mohammed V",0524 431250,0524 431617
Marrakech,HAPPY TRAVEL,"6, Angle Rue Cadi Ayad et Rue Mauritania Résidence Al Manar 4 Bureau n°7, 8 et 9",0524 433317,0524 439755
Marrakech,HARMATTAN,Rue Mahjoub Rmiza 1er étage - Guéliz,0524 449443,0524 449445
Marrakech,HARMONY TRAVEL,"Appt n°3, 2è ETG, Imm 11, Bd Hassan II, Dr Lkoudar, Ait Ourir",0524 480943,neant
Marrakech,HIBISCUS TRAVEL,"3, Rue Al Koronfol Appt 2 Etage 2 Lot Laarissa, Imm Jaouahir",0524 449966,524447666
Marrakech,HOUDA EL RAHMAN,"Bureau n°06, Bd Med V, n°120 Centre d'Affaires Taleb, Guéliz",0524 379174,0524 379174
Marrakech,HUA NIAN TRAVEL AGENCY,"N°1013, Lotissement Zerktouni (Bouaakaz)",0524 204292,neant
Marrakech,IDEAL TRAVEL MOROCCO,"Bd Med V, Imm Generosa II, 1er étage, Appt 3",0524 430306,0524 430305
Marrakech,IMAGINE LE VOYAGE,"Bd Med Zerktouni, n°22, Guéliz",0524 420186,0524 421812
Marrakech,IMZI TOURS INTER,"Angle Rue My Ali et Yougoslavie, Résidence Essaada n°14",0524 433934,0524 438295
Marrakech,INCIRCLE TRAVEL,"Rés Koutoubia centre 2, Bureau n°16, Bd Hassan II",0524 434002,0524 434003
Marrakech,INCURSION TRAVEL,"49/51 Av. Palestine, Résidence Mohamed Maouane, 1er étage, Appt. N°1",0524 291830,0524 291831
Marrakech,INTOUR,"Av. Abdelkrim El Khattabi, Résidence Al Khattabia 3éme étage, n°9 Guéliz",0524 434663,0524 434603
Marrakech,INTREPID MARRAKECH,"Résidence Safaa 41,42, Bloc B, Appt n°19 et 20, 5ème étage, Bd Prince My Abdella",0524 334770,0524 330284
Marrakech,IP VOYAGE GROUPE,"Bureau B09, Res Fajwa, Bd Hassan II",0524 207235,0524 207235
Marrakech,ITINERANCE PLUS,"16/20 Rue Bab Agnaou Bureau n°54, médina",0524 391983,0524 449965
Marrakech,JUMBO MOROCCO INCOMING (PANAFRICAN TOURS,Av. Med V. les Résedences de l'Hivernage Angle Rue Abdelmalek et Av. de France,0524 436030,0524 449056
Marrakech,KAYA TOURS,"Appt n°19, Imm Othmane Rue Maria, camp Mangin n°3, Guéliz",0524 446086,neant
Marrakech,KAZE VOYAGE MOROCCO,"18, Imm Mezrani n°700, Unité 5, Appt 18, Av. Allal El Fassi, Daoudiate",0524 305060,0524 305060
Marrakech,KERMAROC,"Appt n°1, Imm Mbarka, Rue Med El Baqal",0524 433253,0524 433267
Marrakech,KMT VOYAGES,"Av Allal Fassi, Complexe des Habous Imm II, Appt n° 10",0524 313132,0524 301831
Marrakech,KSAR TOURS (EX:LEADER WEB TOURS),"Av. Abdelkrim El Khattabi , Imm Moutacali, 1er étage - Guéliz",0524 420833,0524 420844
Marrakech,LA MAISON DE PELERIN JCI TOURS,"Av. El Mansour Eddahbi, Rés El Habib 65, 4ème étage, Appt n°34, Guéliz",0524 434848,0524 434949
Marrakech,LAMY CONSEIL,"Av Hassan II, Résidence Banine, 4ème étage, Appt 11 Guéliz",0524 435911,0524 435919
Marrakech,LEISURE TRAVEL SERVICE,"Imm Ben Fateh n°8, Appt n°16 4è étage, Rue Loubnane, Guéliz",0524 430374,0524 430170
Marrakech,LIBERTY TRAVEL,"113, Av Abdelkrim Khattabi Appt B14 - Guéliz",0524 436780,0524 436781
Marrakech,LOISIRS ET VOYAGES,"C 6 Rue Razi Badii II, Menara BP 2205 - Guéliz",0524 305000,0524 305242
Marrakech,LUNAFRICA TOURS,"170, Av Abdelkrim El Khattabi n°2",0524 435247,0524 436397
Marrakech,M. TREK AND TOUR,"Yasmine I, n°235, Appt n°2",0524 330597,0524 330597
Marrakech,MADISSON TRAVEL,"N°113, Bloc D, Etage 3, Appt N°10, Av Abdelkrim Khattabi, Guéliz",0524 207316,0524 207306
Marrakech,MAG TRAVELS,"Av. Hassan II, Imm n°12, Appt n°6 2è étage, Guéliz",0524 313943,0524 313943
Marrakech,MAMLAKAT AL ASFAR ET TOURISME,"Imm. n°8, Appt. n°2, Rue Loubnane, Guéliz",0524 438943,0524 439901
Marrakech,MANESKOV TRAVEL,"61, passage Ghandouri, Imm F Appt 12 Guéliz",0524 430074,0524 435735
Marrakech,MAROC EXCURSIONS,"56, Derb El Hammam, Rue Riad Laârousse Medina",0524 375305,0524 375305
Marrakech,MAROC EXPEDITION TRAVEL,"App 13, Rue Ibn Khaldoun",0524 444445,0524 444441
Marrakech,MAROC NATURE SEJOURS ET AVENTURES,"129, Av. Khaled Ibnou El Walid, Résidence El Barouki, Guéliz",0524 447019,0524 447024
Marrakech,MAROC SUR MESURE (Ex:VOYAGEURS DU MONDE),"43 bis, Kawkab Centre, Giéliz",0524 434808,0524 434761
Marrakech,MARRAKECH EXCELLENCE VOYAGE,"Bureau 10, entrée 6, Complexe El Maamri, Av. Allal El Fassi",0524 313030,0524 314589
Marrakech,MARRAKECH HOLIDAYS,"MAG n°16, Av. Abdelkrim Khattabi, n°113, Guéliz",0524 458236,0524 458236
Marrakech,MARRAKECH VOYAGES,"145, Av Med V",0524 432561,0524 434066
Marrakech,MARRAKESH TRAVEL SERVICES,"12, Appt 5, Rue Bani Marine",0524 375251,0524 375263
Marrakech,MAZAR VOYAGES,"Angle Av. Prince My Abdellah et Rue 11 janvier, 1er étage n°19",0524 448630,0524 448680
Marrakech,MC VOYAGES,"5, Lot OLM Quartier El Ghoul Bureau 2",0524 446822,0524 446822
Marrakech,MCI TOURS,"154, Avenue Mohamed V Appt n°9 - Gueliz",0524 438742,0524 446899
Marrakech,MEETING POINT MOROCCO,"Imm Atlas Aguerrabi, 5è étage Av Abdelkrim El Khattabi, Guéliz",0524 437032,0524 437032
Marrakech,MENARA TOURS,"151 rue Mohamed El Beqal, Guéliz",0524 446654,0524 446107
Marrakech,MENHAJ VOYAGES,"Av My Abdellah, Rés Tamaris 10, Imm B, 1er étage, n°13",0524 422860,0524 422862
Marrakech,MESK VOYAGES,"Complexe Kawkab Harti 45, rue Imam Chafai - Guéliz",0524 436215,0524 449104
Marrakech,MONDIAL VOYAGES,"Mag n°115, Résidence Mamoune Cité OLM, Quartier El Ghoul, Guéliz",0524 438484,0524 438485
Marrakech,MOROCCAN CLUB TRAVEL,"Bd. Allal Fassi Ratma Imm. 2, 1er étage Appt. 4",524331594,0524 331399
Marrakech,MOROCCO 5 SENSES LEISURE & EVENTS,"Rue Mauritanie, Imm El Massaoudi 21, Etage E5, Bureau 20",0524 421935,neant
Marrakech,MOROCCO AS YOU WISH,"Sakan En Nakhil, Imm 12, Appt 24, 2è étage Av Moulay Abdellah",0524 457985,neant
Marrakech,MOROCCO ATTRACTIVE TOURS,Rés Noyer D Rue IbnSina Nouri Atlasi Quartier Semlalia 2étage Bur24AtlasiaGuéliz,0524 379180,0524 379180
Marrakech,MOROCCO DISCOVERY,"N°22, Résidence Amira III, 2è Etage Av Yacoub El Mansour, Guéliz",0524 448910,0524 448910
Marrakech,MOROCCO INCOMING SERVICES,"N°6 Imm 90, 3è ètage Dar Essaada",808598539,neant
Marrakech,MOROCCO KEY TOURS,"Imm Berdai C, n°11, Av My El Hassan",0524 201616,0524 201618
Marrakech,MOROCCO PRIVATE TRAVEL,"Résidence Jawad, Av. Abdelkrim Al Khattabi n°22, 1er étage, Guéliz",0524 457752,0524 457753
Marrakech,MOROCCO SAGA,"474, Sidi Ghanem, Appt 9, 2ème étage",0524 623113,0524 336464
Marrakech,MOROCCO TRAVEL HORIZON,"Magasin n°5, RDC Jawahir Bab Doukkala",0524 290394,0524 290392
Marrakech,MOROCCO TRIP TRAVEL,"148 Trik Lagza, RDC Hôtel Al Jazira",0524 059656,0524 059656
Marrakech,MOROCCO UNLIMITED,"Bloc A Rés Borj Ménara 2, Av. Abdelkrim El Khattabi, Imm A, 3è étage, Appt n°12",0524 430322,0524 431508
Marrakech,MOSAIQUE VOYAGES INTERNATIONAL,"Av. Allal El Fassi Imm. 4, Appt 3 Complexe des Habous",0524 313461,0524 314408
Marrakech,MOTIVATION SERVICES,"Av Allal El Fassi, Imm Habouss entrée 6 Appt 7",0524 311593,0524 311592
Marrakech,MOUNTAIN SAFARI TOURS,"64, lot Laksour route de Casablanca BP 2177 Guéliz",0524 308777,0524 308811
Marrakech,MOUNTAIN TRAVEL MOROCCO,"Centre Imlil, Asni 42152, El Haouz",0524 485784,0524 485784
Marrakech,MOUNTAIN VOYAGES,"Résidence El Batoul, Avenue Mohammed V, Appt n°5, Guéliz",0524 421996,0524 421995
Marrakech,MY MOROCCO TRAVEL,"Rue Ibn Sina, Résidence Dina Appt n°15, 3è étage",0524 421357,05244 447741
Marrakech,N G TRAVEL & EVENT,Fraction 19-19 A Bureau 12-3è étage Imm 40 hay Izdihar 2 Manar,0524 205622,neant
Marrakech,NATURE TREKKING MAROC,"Lot Zerktouni, n°1640, 1er étage Mhamid",0524 379880,0524 379880
Marrakech,NOBLE EXPLORER,"N°7, 1er étage, Imm Kadissia Al Izdihar",0524 356135,0524 355935
Marrakech,NOBLE MARHABA TRAVEL,"Lot Al Hadika, RDC n°52, Al Izdihar",0524 358625,neant
Marrakech,NOMADE EXPERIENCE TRAVEL,"N°3, Av. Fatima-Zohra Rmila",0524 387059,0524 384626
Marrakech,NOUVELLES FRONTIERES,"Av, Med V, Guéliz",0524 433605,0524 431134
Marrakech,OMNI TOURS,"220 Av. Med V, Appt 17 Guéliz",0524 421660,0524 421990
Marrakech,ONAY VOYAGES,"Al Massar N°377, 1er étage n°3, Route de Safi",neant,neant
Marrakech,OPERA VOYAGE        EX: (OXFORD TRAVEL),"113, Av Abdelkrim El Khattabi, Appt n°11, Bloc D 3è étage, Guéliz",0524 457575,0524 458281
Marrakech,ORACLE TRAVEL MOROCCO,"Imm. H A, Etage 1, N°154, Rue Sergent Lekbir Ben Bouazza, Ex LT Lamur-Guéliz",0524 438627,0524 438624
Marrakech,ORANGE TOURS(FRAM),"245, Av Mohamed V",0524 339090,0524 432196
Marrakech,ORCHID TOURS,"113, av Abdekrim Khattabi Bat C1 1er étage Guéliz",0524 430818,0524 430848
Marrakech,ORCHIDEE TRAVEL,"Av My Abdellah Imm Ahlam B, n°38 Appt 10 ETG 3",0524 201100,0524 447902
Marrakech,ORIENTAL DREAM TRAVEL,"Bureau n°3, 1er étage, Propriété Moratori-3 Rue Abou Baker Seddiq, Guéliz",0524 207202,neant
Marrakech,ORIGINAL EVENTS,"212, Av. Abdelkrim El Khattabi, Imm Lazrak, Guéliz",0524 430515,0524 430555
Marrakech,ORIGINALLY MOROCCO,"Av. 11 Janvier, Centre d'Affaires Abraj n°7 Imm. C, 3ème étage",0524 457108,0524 457109
Marrakech,OUBADI TRAVEL,"N°37, 4ème Etage, Imm N°24 Angle Guéliz Allal El Fassi",808543714,0808 543714
Marrakech,PALM SAKANE VOYAGE,"Rés El Berdai Place la Liberté, Imm B, 1er étage Bloc A Duplexe 2",0524 446446,0524 446446
Marrakech,PALMIERS VOYAGES,"Av. Hassan II, Imm. des Habous G2 Bab Doukkala",0524 447848,0524 446177
Marrakech,PALOMA TOURS,"18, rue Mauritania Apt 3, Guéliz",0524 446468,0524 449845
Marrakech,PAMPA VOYAGE MAROC,"219, Bd Med V, Imm Jassim Bureau n°35, RDC Guéliz",0524 431052,0524 446455
Marrakech,PANORAMA TOURISME INTERNATIONAL,"245, Av Mohamed V",0524 433654,0524 433554
Marrakech,PLENITUDE VOYAGES,"10, Résidence Warda A, Rue Imam Abou Hanifa Hivernage",0524 422378,0524 422371
Marrakech,POINT MAROC (EX: DESTINATION EVASION MAROC),Soupente n°40 A propriété dite magasin 40 Ahouaz Tassoultante,0524 447375,neant
Marrakech,PONCTUEL VOYAGES,"Rés Ouarda, 2è ETG Appt n°12, Av Yacoub El Mansour, Guéliz Ménara",0524 458695,0524 458695
Marrakech,POUCHKINE VOYAGES,"N°12, Complexe des Habous, Av. Allal El Fassi",671421942,neant
Marrakech,RAYANOX EVENTS,"Lotissement Charaf n°539, Appt 5",0524 059678,neant
Marrakech,RECEPTOURS,"Résidence le Noyer B, RDC Bureau n°2, Rue Ibn Sina Nouri Atlassi, Quartier Semlalia",0524 449162,0524 449759
Marrakech,RIBAT TOURS,"Rue Bab Agnaou, 1er étage, n°80",0524 438693,0524 438694
Marrakech,RS TRAVEL,"Rue Aboubaker Essaddiq, n°14, Imm Moratori, 3è étage, Appt 12, Hivernage",0525 222206,neant
Marrakech,RYAD AU MAROC,"1, Rue Mahjoub Rmiza, Ménara, Giéliz",0524 431900,0524 431786
Marrakech,SCALIGERA VIAGGI,"Borj Menara, Bloc A, n°9, 2è étage, Av. Abdelkrim El Khattabi",0524 336527,0524 336527
Marrakech,SENSORIAL TRAVEL,"223, Bd Mohamed V, Rés Nacarat n°408, Guéliz",neant,neant
